number,value,datetime_start,datetime_complete,duration,params_--d_model,params_--dropout,params_--learning_rate,params_--learning_rate_schedule,params_--n_head,params_--n_layer,params_--num_train_epochs,params_--per_device_train_batch_size,params_--weight_decay,system_attrs_fail_reason,state
108,0.15478162421174219,2020-09-29 19:55:53.452259,2020-09-30 00:41:04.144402,0 days 04:45:10.692143000,256.0,0.2,0.007009967610807942,constant_with_warmup,2.0,2.0,5.0,192.0,1.4788221696115518e-06,,COMPLETE
109,0.32147229234039554,2020-09-29 19:55:53.476570,2020-09-30 00:34:14.860727,0 days 04:38:21.384157000,256.0,0.2,0.0027955160327629205,constant_with_warmup,2.0,2.0,5.0,192.0,1.5182613284963298e-06,,COMPLETE
110,0.2587784480440485,2020-09-29 19:55:53.496049,2020-09-30 01:27:32.382995,0 days 05:31:38.886946000,256.0,0.2,0.007546248561235821,constant_with_warmup,2.0,2.0,5.0,192.0,1.532204403667675e-06,,COMPLETE
111,0.3697321556966484,2020-09-30 00:34:14.953517,2020-09-30 06:22:49.985784,0 days 05:48:35.032267000,128.0,0.2,0.007708957424463831,constant_with_warmup,2.0,2.0,5.0,192.0,1.4132257497919692e-06,,COMPLETE
112,0.21237607888298465,2020-09-30 00:36:12.951507,2020-09-30 06:41:23.276689,0 days 06:05:10.325182000,256.0,0.2,0.008765558697605756,constant_with_warmup,2.0,2.0,5.0,192.0,2.399203705796844e-06,,COMPLETE
113,0.3713464099564518,2020-09-30 00:41:04.197613,2020-09-30 06:22:50.024608,0 days 05:41:45.826995000,128.0,0.2,0.008616206537438794,constant_with_warmup,2.0,2.0,5.0,192.0,1.2114826722806457e-06,,COMPLETE
114,0.24203130904656517,2020-09-30 01:12:17.116460,2020-09-30 06:50:24.339640,0 days 05:38:07.223180000,128.0,0.2,0.002353174687253792,constant_with_warmup,2.0,2.0,5.0,192.0,1.2006218152500393e-06,,COMPLETE
115,0.4560093778483947,2020-09-30 01:27:32.423158,2020-09-30 07:21:39.250366,0 days 05:54:06.827208000,256.0,0.2,0.0043013137929847674,constant_with_warmup,2.0,3.0,5.0,192.0,2.354249262970849e-06,,COMPLETE
116,0.385174197439547,2020-09-30 06:22:50.099943,2020-09-30 10:57:20.488194,0 days 04:34:30.388251000,256.0,0.2,0.004078671909796812,constant_with_warmup,2.0,3.0,5.0,192.0,5.903191258172138e-05,,COMPLETE
117,0.3267543840508075,2020-09-30 06:22:50.147484,2020-09-30 10:50:47.705719,0 days 04:27:57.558235000,256.0,0.2,0.003685011677625933,constant_with_warmup,2.0,3.0,5.0,192.0,2.29185008408239e-06,,COMPLETE
118,0.4100130123875007,2020-09-30 06:41:23.311940,2020-09-30 11:18:00.827434,0 days 04:36:37.515494000,256.0,0.2,0.0036167094452596734,constant_with_warmup,2.0,3.0,5.0,192.0,1.2112124789559858e-06,,COMPLETE
119,0.3252951630861251,2020-09-30 06:50:24.374371,2020-09-30 11:09:10.760223,0 days 04:18:46.385852000,256.0,0.2,0.0058246672734528,constant_with_warmup,2.0,2.0,5.0,192.0,7.783921039109492e-06,,COMPLETE
120,0.3914108996172162,2020-09-30 07:21:39.470088,2020-09-30 12:01:29.191857,0 days 04:39:49.721769000,256.0,0.2,0.003570427477471225,constant_with_warmup,2.0,3.0,5.0,192.0,2.408139516001722e-06,,COMPLETE
121,0.3822036464620224,2020-09-30 10:50:47.781723,2020-09-30 15:20:24.269677,0 days 04:29:36.487954000,256.0,0.2,0.00514471503708581,constant_with_warmup,2.0,3.0,5.0,192.0,5.7031244309015045e-05,,COMPLETE
122,0.4530172581774927,2020-09-30 10:57:20.531471,2020-09-30 15:35:06.124318,0 days 04:37:45.592847000,256.0,0.2,0.004948660633033132,constant_with_warmup,2.0,3.0,5.0,192.0,2.3290058237839416e-05,,COMPLETE
123,0.43408877029856213,2020-09-30 11:09:10.956295,2020-09-30 15:37:09.608191,0 days 04:27:58.651896000,256.0,0.2,0.0048963867790349615,constant_with_warmup,2.0,3.0,5.0,192.0,2.760269472528584e-05,,COMPLETE
