number,value,datetime_start,datetime_complete,duration,params_--d_model,params_--dropout,params_--learning_rate,params_--learning_rate_schedule,params_--n_layer,params_--num_train_epochs,params_--per_device_train_batch_size,params_--weight_decay,system_attrs_fail_reason,state
0,0.1803282588419207,2020-10-06 03:09:22.789423,2020-10-06 05:15:28.747426,0 days 02:06:05.958003000,192.0,0.0,0.0001394815205750684,constant_with_warmup,3.0,3.0,192.0,3.377914208902549e-05,,COMPLETE
1,,2020-10-06 03:09:23.133850,2020-10-06 09:18:04.251489,0 days 06:08:41.117639000,128.0,0.2,0.0009985445526816442,cosine_with_warmup,3.0,10.0,64.0,6.500280412709172e-06,"Trial 1 failed, because the returned value from the objective function cannot be cast to float. Returned value is: None",FAIL
2,0.21602078267465788,2020-10-06 03:09:23.222095,2020-10-06 05:52:40.422522,0 days 02:43:17.200427000,128.0,0.2,0.0006602328777210343,linear_with_warmup,3.0,5.0,192.0,2.175460990219653e-06,,COMPLETE
3,0.18302059802893958,2020-10-06 03:09:23.315372,2020-10-06 06:18:03.135391,0 days 03:08:39.820019000,192.0,0.1,0.00012400668482110831,linear_with_warmup,2.0,6.0,192.0,3.466462995944887e-06,,COMPLETE
4,,2020-10-06 03:09:23.767754,2020-10-06 06:39:54.871971,0 days 03:30:31.104217000,320.0,0.2,0.0011152695792075314,cosine_with_warmup,1.0,8.0,64.0,8.12855552073872e-06,"Trial 4 failed, because the returned value from the objective function cannot be cast to float. Returned value is: None",FAIL
5,0.15876169544998114,2020-10-06 05:15:29.335775,2020-10-06 07:27:26.155545,0 days 02:11:56.819770000,128.0,0.0,0.0002720767898647538,linear_with_warmup,3.0,4.0,256.0,1.446888907498163e-05,,COMPLETE
6,0.10169012257273713,2020-10-06 05:52:41.003596,2020-10-06 07:18:07.209455,0 days 01:25:26.205859000,64.0,0.3,0.000213666737664151,cosine_with_warmup,2.0,2.0,192.0,5.19176463917933e-06,,COMPLETE
7,0.17735911502962573,2020-10-06 06:18:04.120397,2020-10-06 07:32:54.281377,0 days 01:14:50.160980000,256.0,0.2,0.0006094068913957327,linear_with_warmup,2.0,1.0,192.0,1.8705536882442493e-05,,COMPLETE
8,,2020-10-06 06:39:55.242886,2020-10-06 06:40:35.175296,0 days 00:00:39.932410000,192.0,0.0,0.0003558807506958683,cosine_with_warmup,2.0,8.0,256.0,5.009802143095546e-05,"Trial 8 failed, because the returned value from the objective function cannot be cast to float. Returned value is: None",FAIL
9,,2020-10-06 06:40:38.121389,2020-10-06 06:41:15.565802,0 days 00:00:37.444413000,192.0,0.2,0.00021726531549637231,cosine_with_warmup,2.0,7.0,64.0,1.448108200357918e-06,"Trial 9 failed, because the returned value from the objective function cannot be cast to float. Returned value is: None",FAIL
10,,2020-10-06 06:41:16.434478,2020-10-06 06:41:57.769463,0 days 00:00:41.334985000,128.0,0.3,0.00015143597127532945,cosine_with_warmup,3.0,10.0,192.0,2.142749477763517e-05,"Trial 10 failed, because the returned value from the objective function cannot be cast to float. Returned value is: None",FAIL
11,,2020-10-06 06:41:58.743090,2020-10-06 06:42:38.891141,0 days 00:00:40.148051000,192.0,0.2,0.0002538023104383513,cosine_with_warmup,3.0,5.0,192.0,9.02544061288103e-05,"Trial 11 failed, because the returned value from the objective function cannot be cast to float. Returned value is: None",FAIL
12,0.18555429294257372,2020-10-06 06:42:39.883483,2020-10-06 11:36:13.827800,0 days 04:53:33.944317000,256.0,0.2,0.0030420094674755535,constant_with_warmup,1.0,7.0,64.0,5.5491891113478215e-05,,COMPLETE
13,0.22197824062923965,2020-10-06 07:18:09.225027,2020-10-06 10:21:58.751840,0 days 03:03:49.526813000,256.0,0.2,0.0013607708695356224,cosine_with_warmup,3.0,5.0,192.0,1.6470069332862774e-05,,COMPLETE
14,,2020-10-06 07:27:26.769159,2020-10-06 11:58:53.398394,0 days 04:31:26.629235000,256.0,0.3,0.006314201485032137,linear_with_warmup,1.0,10.0,64.0,1.646200919647076e-06,"Trial 14 failed, because the returned value from the objective function cannot be cast to float. Returned value is: None",FAIL
15,0.23285858988136812,2020-10-06 07:32:54.954983,2020-10-06 10:14:55.066429,0 days 02:42:00.111446000,64.0,0.3,0.004583315782680164,linear_with_warmup,2.0,6.0,256.0,1.4110957159691926e-06,,COMPLETE
16,,2020-10-06 09:18:04.409585,2020-10-06 09:18:43.712775,0 days 00:00:39.303190000,64.0,0.0,0.00022460710743134327,linear_with_warmup,1.0,1.0,64.0,4.228421807203208e-05,"Trial 16 failed, because the returned value from the objective function cannot be cast to float. Returned value is: None",FAIL
17,,2020-10-06 09:18:43.995192,2020-10-06 09:19:26.683229,0 days 00:00:42.688037000,128.0,0.2,0.0001740433828464356,constant_with_warmup,1.0,9.0,128.0,5.841369152421153e-05,"Trial 17 failed, because the returned value from the objective function cannot be cast to float. Returned value is: None",FAIL
18,,2020-10-06 09:19:27.141727,2020-10-06 09:20:05.713354,0 days 00:00:38.571627000,256.0,0.2,0.0007282513535457703,cosine_with_warmup,1.0,6.0,256.0,1.189022744425094e-05,"Trial 18 failed, because the returned value from the objective function cannot be cast to float. Returned value is: None",FAIL
19,,2020-10-06 09:20:07.804567,,,,,,,,,,,,RUNNING
20,,2020-10-06 10:14:55.640685,,,,,,,,,,,,RUNNING
21,,2020-10-06 10:21:59.813177,,,,,,,,,,,,RUNNING
22,,2020-10-06 11:36:14.348471,,,,,,,,,,,,RUNNING
23,,2020-10-06 11:58:54.612634,2020-10-06 11:59:40.036155,0 days 00:00:45.423521000,192.0,0.1,0.0024722928898120032,linear_with_warmup,4.0,8.0,192.0,8.014808662293123e-05,"Trial 23 failed, because the returned value from the objective function cannot be cast to float. Returned value is: None",FAIL
24,,2020-10-06 11:59:40.503133,2020-10-06 12:00:21.119163,0 days 00:00:40.616030000,320.0,0.0,0.0021124596983245585,constant_with_warmup,1.0,8.0,192.0,5.504155686327943e-06,"Trial 24 failed, because the returned value from the objective function cannot be cast to float. Returned value is: None",FAIL
25,,2020-10-06 12:00:21.527789,,,,,,,,,,,,RUNNING
26,0.24093160015081613,2020-10-06 12:46:47.304662,2020-10-06 16:27:36.167777,0 days 03:40:48.863115000,64.0,0.0,0.0019480362791209997,linear_with_warmup,3.0,9.0,256.0,2.51834659612757e-05,,COMPLETE
27,0.17613492326890487,2020-10-06 12:46:47.466893,2020-10-06 14:17:17.406092,0 days 01:30:29.939199000,128.0,0.1,0.00257603929569196,linear_with_warmup,4.0,2.0,256.0,2.0195498049158198e-06,,COMPLETE
28,0.2352068648044859,2020-10-06 12:47:03.729141,2020-10-06 15:21:29.404270,0 days 02:34:25.675129000,192.0,0.0,0.0012508950681646045,constant_with_warmup,2.0,3.0,64.0,4.504730112848893e-05,,COMPLETE
29,0.11747925144145045,2020-10-06 12:47:03.835572,2020-10-06 13:57:06.476611,0 days 01:10:02.641039000,64.0,0.1,0.0011074917075989542,cosine_with_warmup,4.0,1.0,192.0,4.746839284955506e-06,,COMPLETE
30,0.16263947768391668,2020-10-06 12:47:04.025757,2020-10-06 14:14:26.710250,0 days 01:27:22.684493000,64.0,0.2,0.0054936389769551465,constant_with_warmup,3.0,2.0,256.0,5.735330633481146e-06,,COMPLETE
31,,2020-10-06 13:57:07.239629,,,,,,,,,,,,RUNNING
32,,2020-10-06 14:14:27.535020,,,,,,,,,,,,RUNNING
33,,2020-10-06 14:17:18.065639,,,,,,,,,,,,RUNNING
34,,2020-10-06 15:21:29.806706,2020-10-06 15:46:53.245512,0 days 00:25:23.438806000,192.0,0.3,0.008517469562345337,constant_with_warmup,1.0,10.0,64.0,8.679869961166459e-05,"Trial 34 failed, because the returned value from the objective function cannot be cast to float. Returned value is: None",FAIL
35,,2020-10-06 15:46:53.353180,2020-10-06 15:47:43.483429,0 days 00:00:50.130249000,192.0,0.3,0.008160819703391007,constant_with_warmup,1.0,9.0,64.0,9.485502392236168e-05,"Trial 35 failed, because the returned value from the objective function cannot be cast to float. Returned value is: None",FAIL
36,,2020-10-06 15:47:43.659744,,,,,,,,,,,,RUNNING
37,,2020-10-06 16:27:36.516176,,,,,,,,,,,,RUNNING
38,,2020-10-06 20:31:31.768979,2020-10-06 22:37:42.545284,0 days 02:06:10.776305000,192.0,0.0,0.001618910834025678,constant_with_warmup,1.0,10.0,64.0,9.90329955113397e-05,"Trial 38 failed, because the returned value from the objective function cannot be cast to float. Returned value is: None",FAIL
39,,2020-10-06 20:31:31.982995,2020-10-07 00:12:57.360720,0 days 03:41:25.377725000,192.0,0.0,0.009004091914248101,constant_with_warmup,1.0,10.0,64.0,7.370979490448114e-05,"Trial 39 failed, because the returned value from the objective function cannot be cast to float. Returned value is: None",FAIL
40,,2020-10-06 20:31:32.117422,2020-10-07 01:46:51.930679,0 days 05:15:19.813257000,192.0,0.0,0.0016963592570600867,constant_with_warmup,1.0,10.0,64.0,8.722177629614115e-05,"Trial 40 failed, because the returned value from the objective function cannot be cast to float. Returned value is: None",FAIL
41,,2020-10-06 20:31:32.246036,2020-10-07 00:53:36.060183,0 days 04:22:03.814147000,192.0,0.0,0.009787119104971277,constant_with_warmup,1.0,10.0,64.0,9.528286231808619e-05,"Trial 41 failed, because the returned value from the objective function cannot be cast to float. Returned value is: None",FAIL
42,,2020-10-06 20:31:32.247324,2020-10-06 23:26:07.447122,0 days 02:54:35.199798000,192.0,0.0,0.0022017275538477343,constant_with_warmup,1.0,10.0,64.0,5.162328714617684e-05,"Trial 42 failed, because the returned value from the objective function cannot be cast to float. Returned value is: None",FAIL
43,,2020-10-06 22:37:42.977779,2020-10-07 02:02:23.620450,0 days 03:24:40.642671000,192.0,0.0,0.0018967609222014683,constant_with_warmup,1.0,10.0,64.0,9.72824399606805e-05,"Trial 43 failed, because the returned value from the objective function cannot be cast to float. Returned value is: None",FAIL
44,0.21057272090435983,2020-10-06 23:26:07.574611,2020-10-07 06:22:50.815492,0 days 06:56:43.240881000,192.0,0.0,0.0017622587122626014,constant_with_warmup,1.0,10.0,64.0,8.297089902184327e-05,,COMPLETE
45,,2020-10-07 00:12:57.581190,2020-10-07 03:09:47.160932,0 days 02:56:49.579742000,192.0,0.0,0.0018190547780123439,constant_with_warmup,1.0,10.0,64.0,9.037331066918899e-05,"Trial 45 failed, because the returned value from the objective function cannot be cast to float. Returned value is: None",FAIL
46,,2020-10-07 00:53:36.232534,2020-10-07 04:17:38.558596,0 days 03:24:02.326062000,192.0,0.0,0.009483256462041954,constant_with_warmup,1.0,10.0,64.0,9.932705059318884e-05,"Trial 46 failed, because the returned value from the objective function cannot be cast to float. Returned value is: None",FAIL
47,,2020-10-07 01:46:52.364484,2020-10-07 04:42:21.867234,0 days 02:55:29.502750000,192.0,0.0,0.0016573061310247385,constant_with_warmup,1.0,9.0,64.0,9.545626048932232e-05,"Trial 47 failed, because the returned value from the objective function cannot be cast to float. Returned value is: None",FAIL
48,,2020-10-07 02:02:23.984452,2020-10-07 02:02:59.738550,0 days 00:00:35.754098000,192.0,0.0,0.009373347213136042,constant_with_warmup,1.0,10.0,64.0,7.415277200646709e-05,"Trial 48 failed, because the returned value from the objective function cannot be cast to float. Returned value is: None",FAIL
49,,2020-10-07 02:03:00.065231,2020-10-07 06:09:05.843326,0 days 04:06:05.778095000,192.0,0.0,0.0018083743690340015,constant_with_warmup,1.0,9.0,64.0,7.492309472366839e-05,"Trial 49 failed, because the returned value from the objective function cannot be cast to float. Returned value is: None",FAIL
50,,2020-10-07 03:09:47.345165,2020-10-07 05:57:22.684015,0 days 02:47:35.338850000,192.0,0.0,0.0017763385726716344,constant_with_warmup,1.0,10.0,64.0,9.546323081031872e-05,"Trial 50 failed, because the returned value from the objective function cannot be cast to float. Returned value is: None",FAIL
51,,2020-10-07 04:17:40.555809,2020-10-07 04:18:23.744801,0 days 00:00:43.188992000,192.0,0.0,0.009652478268389268,constant_with_warmup,1.0,10.0,64.0,9.305299318284157e-05,"Trial 51 failed, because the returned value from the objective function cannot be cast to float. Returned value is: None",FAIL
52,,2020-10-07 04:18:24.080428,2020-10-07 04:19:15.751001,0 days 00:00:51.670573000,192.0,0.0,0.00958109857134575,constant_with_warmup,1.0,10.0,64.0,9.862515023215598e-05,"Trial 52 failed, because the returned value from the objective function cannot be cast to float. Returned value is: None",FAIL
53,,2020-10-07 04:19:15.948620,2020-10-07 07:53:28.270894,0 days 03:34:12.322274000,192.0,0.0,0.0019848541111663954,constant_with_warmup,1.0,10.0,64.0,9.469723819622017e-05,"Trial 53 failed, because the returned value from the objective function cannot be cast to float. Returned value is: None",FAIL
54,,2020-10-07 04:42:22.089000,2020-10-07 08:01:34.423785,0 days 03:19:12.334785000,192.0,0.0,0.001888684849007052,constant_with_warmup,1.0,10.0,64.0,9.751614887141593e-05,"Trial 54 failed, because the returned value from the objective function cannot be cast to float. Returned value is: None",FAIL
55,,2020-10-07 05:57:23.488714,2020-10-07 09:02:28.034666,0 days 03:05:04.545952000,192.0,0.0,0.009217312807996054,constant_with_warmup,1.0,10.0,64.0,9.341344664109232e-05,"Trial 55 failed, because the returned value from the objective function cannot be cast to float. Returned value is: None",FAIL
56,,2020-10-07 06:09:06.890344,2020-10-07 06:09:55.349666,0 days 00:00:48.459322000,192.0,0.0,0.0015403218541521877,constant_with_warmup,1.0,10.0,64.0,9.759929601002054e-05,"Trial 56 failed, because the returned value from the objective function cannot be cast to float. Returned value is: None",FAIL
57,,2020-10-07 06:09:55.619917,2020-10-07 06:10:37.477841,0 days 00:00:41.857924000,192.0,0.0,0.009377134204235391,constant_with_warmup,1.0,10.0,64.0,9.800282720531523e-05,"Trial 57 failed, because the returned value from the objective function cannot be cast to float. Returned value is: None",FAIL
58,,2020-10-07 06:10:37.909611,2020-10-07 08:59:11.809218,0 days 02:48:33.899607000,192.0,0.0,0.0020382250021651863,constant_with_warmup,1.0,10.0,64.0,8.794255876251014e-05,"Trial 58 failed, because the returned value from the objective function cannot be cast to float. Returned value is: None",FAIL
59,,2020-10-07 06:22:55.106227,2020-10-07 11:02:19.107151,0 days 04:39:24.000924000,192.0,0.0,0.008676213597392604,constant_with_warmup,1.0,9.0,128.0,3.330065498506646e-05,"Trial 59 failed, because the returned value from the objective function cannot be cast to float. Returned value is: None",FAIL
60,,2020-10-07 07:53:28.529221,2020-10-07 07:54:09.799050,0 days 00:00:41.269829000,192.0,0.0,0.008973841591453764,constant_with_warmup,1.0,10.0,128.0,3.9888211366285255e-05,"Trial 60 failed, because the returned value from the objective function cannot be cast to float. Returned value is: None",FAIL
61,,2020-10-07 07:54:10.976018,2020-10-07 07:54:48.832254,0 days 00:00:37.856236000,192.0,0.0,0.008519719079272488,constant_with_warmup,1.0,10.0,128.0,3.5798643190713524e-05,"Trial 61 failed, because the returned value from the objective function cannot be cast to float. Returned value is: None",FAIL
62,,2020-10-07 07:54:49.669790,2020-10-07 07:55:30.886505,0 days 00:00:41.216715000,192.0,0.0,0.0005875990593713013,constant_with_warmup,1.0,10.0,128.0,3.3659986691155806e-05,"Trial 62 failed, because the returned value from the objective function cannot be cast to float. Returned value is: None",FAIL
63,,2020-10-07 07:55:31.008442,2020-10-07 07:56:07.663484,0 days 00:00:36.655042000,192.0,0.0,0.0005534679085771418,constant_with_warmup,1.0,10.0,128.0,3.785566891598603e-05,"Trial 63 failed, because the returned value from the objective function cannot be cast to float. Returned value is: None",FAIL
64,,2020-10-07 07:56:07.920472,2020-10-07 08:01:34.292326,0 days 00:05:26.371854000,192.0,0.0,0.0006497244150299093,constant_with_warmup,1.0,10.0,128.0,3.546721387640539e-05,"Trial 64 failed, because the returned value from the objective function cannot be cast to float. Returned value is: None",FAIL
65,,2020-10-07 08:01:34.543490,2020-10-07 12:35:53.226115,0 days 04:34:18.682625000,192.0,0.0,0.008963455536666278,constant_with_warmup,1.0,10.0,128.0,3.508569897806525e-05,"Trial 65 failed, because the returned value from the objective function cannot be cast to float. Returned value is: None",FAIL
66,,2020-10-07 08:01:35.048018,2020-10-07 08:02:20.317521,0 days 00:00:45.269503000,192.0,0.0,0.009542533134996452,constant_with_warmup,1.0,10.0,128.0,4.305568321014461e-05,"Trial 66 failed, because the returned value from the objective function cannot be cast to float. Returned value is: None",FAIL
67,,2020-10-07 08:02:20.459237,2020-10-07 08:03:08.421437,0 days 00:00:47.962200000,192.0,0.0,0.009142617408958826,constant_with_warmup,1.0,10.0,128.0,3.616038082013768e-05,"Trial 67 failed, because the returned value from the objective function cannot be cast to float. Returned value is: None",FAIL
68,,2020-10-07 08:03:08.666315,2020-10-07 12:51:01.016546,0 days 04:47:52.350231000,192.0,0.0,0.009644266698600669,constant_with_warmup,1.0,10.0,128.0,4.36771952838257e-05,"Trial 68 failed, because the returned value from the objective function cannot be cast to float. Returned value is: None",FAIL
69,,2020-10-07 08:59:11.960648,2020-10-07 09:00:03.985854,0 days 00:00:52.025206000,192.0,0.0,0.008663653183672598,constant_with_warmup,1.0,10.0,128.0,3.1269701848631725e-05,"Trial 69 failed, because the returned value from the objective function cannot be cast to float. Returned value is: None",FAIL
70,,2020-10-07 09:00:04.239629,2020-10-07 09:02:27.286757,0 days 00:02:23.047128000,192.0,0.0,0.0005765858211545419,constant_with_warmup,1.0,10.0,128.0,3.4992081072888853e-05,"Trial 70 failed, because the returned value from the objective function cannot be cast to float. Returned value is: None",FAIL
71,,2020-10-07 09:02:27.413518,2020-10-07 09:03:11.061323,0 days 00:00:43.647805000,192.0,0.0,0.0005291554222955681,constant_with_warmup,1.0,9.0,128.0,4.919748370336022e-05,"Trial 71 failed, because the returned value from the objective function cannot be cast to float. Returned value is: None",FAIL
72,,2020-10-07 09:02:28.191899,2020-10-07 09:03:09.415231,0 days 00:00:41.223332000,192.0,0.0,0.009210990892621597,constant_with_warmup,1.0,10.0,128.0,4.361015325615513e-05,"Trial 72 failed, because the returned value from the objective function cannot be cast to float. Returned value is: None",FAIL
73,,2020-10-07 09:03:09.593685,2020-10-07 09:03:58.481609,0 days 00:00:48.887924000,192.0,0.0,0.0005359569568928821,constant_with_warmup,1.0,10.0,128.0,3.711655143743274e-05,"Trial 73 failed, because the returned value from the objective function cannot be cast to float. Returned value is: None",FAIL
74,,2020-10-07 09:03:11.195997,2020-10-07 09:03:58.385119,0 days 00:00:47.189122000,192.0,0.0,0.0005913850547640838,constant_with_warmup,1.0,10.0,128.0,3.624712282209288e-05,"Trial 74 failed, because the returned value from the objective function cannot be cast to float. Returned value is: None",FAIL
75,,2020-10-07 09:03:58.695950,2020-10-07 09:04:41.067397,0 days 00:00:42.371447000,192.0,0.0,0.007873690725067335,constant_with_warmup,1.0,10.0,128.0,3.2654525913883565e-05,"Trial 75 failed, because the returned value from the objective function cannot be cast to float. Returned value is: None",FAIL
76,,2020-10-07 09:03:58.803150,2020-10-07 09:04:42.503385,0 days 00:00:43.700235000,192.0,0.0,0.0006020967265294773,constant_with_warmup,1.0,10.0,128.0,3.726087344512027e-05,"Trial 76 failed, because the returned value from the objective function cannot be cast to float. Returned value is: None",FAIL
77,,2020-10-07 09:04:41.205717,2020-10-07 13:57:59.126219,0 days 04:53:17.920502000,192.0,0.0,0.000530084690210785,constant_with_warmup,1.0,10.0,128.0,3.6690234994639093e-05,"Trial 77 failed, because the returned value from the objective function cannot be cast to float. Returned value is: None",FAIL
78,,2020-10-07 09:04:43.166771,2020-10-07 09:05:49.445398,0 days 00:01:06.278627000,192.0,0.0,0.0003969409956773157,constant_with_warmup,1.0,10.0,128.0,3.5728854280889295e-05,"Trial 78 failed because of the following error: KeyError(<autobench.core.job.Job object at 0x7fd663c607f0>,)",FAIL
79,,2020-10-07 09:05:50.078028,2020-10-07 13:20:18.975082,0 days 04:14:28.897054000,192.0,0.0,0.00962010933645707,constant_with_warmup,1.0,10.0,128.0,3.566861181586805e-05,"Trial 79 failed, because the returned value from the objective function cannot be cast to float. Returned value is: None",FAIL
80,,2020-10-07 11:02:19.658312,,,,,,,,,,,,RUNNING
81,,2020-10-07 12:35:53.763873,,,,,,,,,,,,RUNNING
82,,2020-10-07 12:51:01.434504,,,,,,,,,,,,RUNNING
83,,2020-10-07 13:20:19.201986,2020-10-07 13:20:52.601866,0 days 00:00:33.399880000,192.0,0.0,0.00990782705538931,constant_with_warmup,1.0,10.0,128.0,3.7960984213082475e-05,"Trial 83 failed, because the returned value from the objective function cannot be cast to float. Returned value is: None",FAIL
84,,2020-10-07 13:20:52.775763,2020-10-07 13:21:35.644697,0 days 00:00:42.868934000,192.0,0.0,0.008923082186618261,constant_with_warmup,1.0,10.0,128.0,4.348425443582706e-05,"Trial 84 failed, because the returned value from the objective function cannot be cast to float. Returned value is: None",FAIL
85,,2020-10-07 13:21:38.801218,2020-10-07 13:22:13.597443,0 days 00:00:34.796225000,192.0,0.0,0.009388793345452803,constant_with_warmup,1.0,10.0,128.0,3.669233431607474e-05,"Trial 85 failed, because the returned value from the objective function cannot be cast to float. Returned value is: None",FAIL
86,,2020-10-07 13:22:13.765195,,,,,,,,,,,,RUNNING
87,,2020-10-07 16:45:54.422064,2020-10-08 00:42:06.847247,0 days 07:56:12.425183000,320.0,0.0,0.008444372686477516,constant_with_warmup,1.0,10.0,128.0,3.658093255903163e-05,"Trial 87 failed, because the returned value from the objective function cannot be cast to float. Returned value is: None",FAIL
