number,value,datetime_start,datetime_complete,duration,params_--d_model,params_--dropout,params_--learning_rate,params_--learning_rate_schedule,params_--n_layer,params_--num_train_epochs,params_--per_device_train_batch_size,params_--weight_decay,system_attrs_fail_reason,state
174,,2020-10-09 14:03:23.434096,2020-10-09 14:04:03.135185,0 days 00:00:39.701089000,256.0,0.1,0.0002398673216444088,linear_with_warmup,1.0,8.0,192.0,7.322664536539606e-05,"Trial 174 failed, because the returned value from the objective function cannot be cast to float. Returned value is: None",FAIL
175,,2020-10-09 14:03:40.401038,2020-10-09 14:04:22.469932,0 days 00:00:42.068894000,256.0,0.1,0.00024795518971644194,linear_with_warmup,1.0,8.0,192.0,9.47712398345991e-05,"Trial 175 failed, because the returned value from the objective function cannot be cast to float. Returned value is: None",FAIL
176,,2020-10-09 14:04:03.539311,2020-10-09 14:04:43.397045,0 days 00:00:39.857734000,256.0,0.1,0.00026302516849736126,linear_with_warmup,1.0,8.0,192.0,7.234780119059379e-05,"Trial 176 failed, because the returned value from the objective function cannot be cast to float. Returned value is: None",FAIL
177,,2020-10-09 14:04:22.668122,2020-10-09 14:05:05.388518,0 days 00:00:42.720396000,256.0,0.1,0.0002688758680043498,linear_with_warmup,1.0,8.0,192.0,7.097653199709017e-05,"Trial 177 failed, because the returned value from the objective function cannot be cast to float. Returned value is: None",FAIL
178,,2020-10-09 14:04:43.884720,2020-10-09 14:05:22.367478,0 days 00:00:38.482758000,256.0,0.1,0.00026097295382862193,linear_with_warmup,1.0,8.0,192.0,7.315944210326301e-05,"Trial 178 failed, because the returned value from the objective function cannot be cast to float. Returned value is: None",FAIL
179,,2020-10-09 14:05:07.903454,2020-10-09 14:05:42.404239,0 days 00:00:34.500785000,256.0,0.1,0.00028089922947876285,linear_with_warmup,1.0,8.0,192.0,7.289477203333422e-05,"Trial 179 failed, because the returned value from the objective function cannot be cast to float. Returned value is: None",FAIL
180,,2020-10-09 14:05:22.813013,2020-10-09 14:06:03.590183,0 days 00:00:40.777170000,256.0,0.1,0.0002976069721707104,linear_with_warmup,1.0,8.0,192.0,7.354902768712451e-05,"Trial 180 failed, because the returned value from the objective function cannot be cast to float. Returned value is: None",FAIL
181,,2020-10-09 14:05:42.850716,2020-10-09 14:06:20.366533,0 days 00:00:37.515817000,256.0,0.1,0.00028281126587261917,linear_with_warmup,1.0,8.0,192.0,7.436514224992679e-05,"Trial 181 failed, because the returned value from the objective function cannot be cast to float. Returned value is: None",FAIL
182,,2020-10-09 14:06:04.156377,2020-10-09 14:06:43.021368,0 days 00:00:38.864991000,256.0,0.1,0.0002552610071007718,linear_with_warmup,1.0,8.0,192.0,7.140348154474369e-05,"Trial 182 failed, because the returned value from the objective function cannot be cast to float. Returned value is: None",FAIL
183,,2020-10-09 14:06:20.746388,2020-10-09 14:07:01.001626,0 days 00:00:40.255238000,256.0,0.1,0.00026202433756817114,linear_with_warmup,1.0,8.0,192.0,6.782716252245243e-05,"Trial 183 failed, because the returned value from the objective function cannot be cast to float. Returned value is: None",FAIL
184,,2020-10-09 14:06:43.168148,2020-10-09 14:07:24.269956,0 days 00:00:41.101808000,256.0,0.1,0.00025172935150420694,linear_with_warmup,1.0,8.0,192.0,8.016958557178172e-05,"Trial 184 failed, because the returned value from the objective function cannot be cast to float. Returned value is: None",FAIL
185,,2020-10-09 14:07:04.020905,2020-10-09 14:07:39.989073,0 days 00:00:35.968168000,256.0,0.1,0.00026992517747545676,linear_with_warmup,1.0,8.0,192.0,7.446553807757757e-05,"Trial 185 failed, because the returned value from the objective function cannot be cast to float. Returned value is: None",FAIL
186,,2020-10-09 14:07:25.022734,2020-10-09 14:08:06.504658,0 days 00:00:41.481924000,256.0,0.1,0.00029991281548144615,linear_with_warmup,1.0,8.0,192.0,7.383259419931537e-05,"Trial 186 failed, because the returned value from the objective function cannot be cast to float. Returned value is: None",FAIL
187,,2020-10-09 14:07:40.999922,2020-10-09 14:08:20.913397,0 days 00:00:39.913475000,256.0,0.1,0.00027361835533321597,linear_with_warmup,1.0,8.0,192.0,7.303084134590314e-05,"Trial 187 failed, because the returned value from the objective function cannot be cast to float. Returned value is: None",FAIL
188,,2020-10-09 14:08:07.013305,2020-10-09 14:08:43.939426,0 days 00:00:36.926121000,256.0,0.1,0.0002696869775303911,linear_with_warmup,1.0,8.0,192.0,7.124438961392143e-05,"Trial 188 failed, because the returned value from the objective function cannot be cast to float. Returned value is: None",FAIL
189,,2020-10-09 14:08:21.928005,2020-10-09 14:09:00.651693,0 days 00:00:38.723688000,256.0,0.1,0.00025379595390131646,linear_with_warmup,1.0,8.0,192.0,7.459970143753666e-05,"Trial 189 failed, because the returned value from the objective function cannot be cast to float. Returned value is: None",FAIL
190,,2020-10-09 14:08:44.868957,2020-10-09 14:09:23.341596,0 days 00:00:38.472639000,256.0,0.1,0.0002626589227169041,linear_with_warmup,1.0,8.0,192.0,7.379946828479622e-05,"Trial 190 failed, because the returned value from the objective function cannot be cast to float. Returned value is: None",FAIL
191,,2020-10-09 14:09:00.941227,2020-10-09 14:09:40.124542,0 days 00:00:39.183315000,256.0,0.1,0.00024574182658207303,linear_with_warmup,1.0,8.0,192.0,7.198012765030082e-05,"Trial 191 failed, because the returned value from the objective function cannot be cast to float. Returned value is: None",FAIL
192,,2020-10-09 14:09:23.823709,2020-10-09 14:10:05.127593,0 days 00:00:41.303884000,256.0,0.1,0.00024335362749341546,linear_with_warmup,1.0,8.0,192.0,7.348948754631098e-05,"Trial 192 failed, because the returned value from the objective function cannot be cast to float. Returned value is: None",FAIL
193,0.2482501136776402,2020-10-09 14:09:40.557253,2020-10-09 17:38:44.674517,0 days 03:29:04.117264000,256.0,0.1,0.000256152811010137,linear_with_warmup,1.0,8.0,192.0,7.102249297851674e-05,,COMPLETE
194,,2020-10-09 14:10:05.832720,2020-10-09 14:10:44.022553,0 days 00:00:38.189833000,256.0,0.1,0.0002873365342613045,linear_with_warmup,1.0,8.0,192.0,6.943853320882428e-05,"Trial 194 failed, because the returned value from the objective function cannot be cast to float. Returned value is: None",FAIL
195,,2020-10-09 14:10:08.523754,2020-10-09 14:10:54.089438,0 days 00:00:45.565684000,256.0,0.1,0.0002656417450614843,linear_with_warmup,1.0,8.0,192.0,7.423469742569929e-05,"Trial 195 failed, because the returned value from the objective function cannot be cast to float. Returned value is: None",FAIL
196,,2020-10-09 14:10:44.453892,2020-10-09 14:11:24.857280,0 days 00:00:40.403388000,256.0,0.1,0.0002560396654719243,linear_with_warmup,1.0,8.0,192.0,7.43360290505564e-05,"Trial 196 failed, because the returned value from the objective function cannot be cast to float. Returned value is: None",FAIL
197,,2020-10-09 14:10:54.296944,2020-10-09 14:11:31.726679,0 days 00:00:37.429735000,256.0,0.1,0.00024690051271612795,linear_with_warmup,1.0,8.0,192.0,7.437876124857597e-05,"Trial 197 failed, because the returned value from the objective function cannot be cast to float. Returned value is: None",FAIL
198,,2020-10-09 14:11:25.343449,2020-10-09 14:12:03.336180,0 days 00:00:37.992731000,256.0,0.1,0.00024254603231810406,linear_with_warmup,1.0,8.0,192.0,7.196366169685878e-05,"Trial 198 failed, because the returned value from the objective function cannot be cast to float. Returned value is: None",FAIL
199,,2020-10-09 14:11:32.592721,2020-10-09 14:12:12.990053,0 days 00:00:40.397332000,256.0,0.1,0.0002590933633985695,linear_with_warmup,1.0,8.0,192.0,9.905033628975124e-05,"Trial 199 failed, because the returned value from the objective function cannot be cast to float. Returned value is: None",FAIL
200,,2020-10-09 14:12:03.729916,2020-10-09 14:12:43.937585,0 days 00:00:40.207669000,256.0,0.1,0.00022171252459413744,linear_with_warmup,1.0,8.0,192.0,7.580915090177166e-05,"Trial 200 failed, because the returned value from the objective function cannot be cast to float. Returned value is: None",FAIL
201,,2020-10-09 14:12:14.008866,2020-10-09 14:13:00.842155,0 days 00:00:46.833289000,256.0,0.1,0.0002570978087999566,linear_with_warmup,1.0,8.0,192.0,7.484290269800365e-05,"Trial 201 failed, because the returned value from the objective function cannot be cast to float. Returned value is: None",FAIL
202,,2020-10-09 14:12:44.847349,2020-10-09 14:13:24.217601,0 days 00:00:39.370252000,256.0,0.1,0.0002543780701871516,linear_with_warmup,1.0,8.0,192.0,7.407659882028738e-05,"Trial 202 failed, because the returned value from the objective function cannot be cast to float. Returned value is: None",FAIL
203,,2020-10-09 14:13:02.227410,2020-10-09 14:13:42.879237,0 days 00:00:40.651827000,256.0,0.1,0.0002486135046435451,linear_with_warmup,1.0,8.0,192.0,7.490087180480412e-05,"Trial 203 failed, because the returned value from the objective function cannot be cast to float. Returned value is: None",FAIL
204,,2020-10-09 14:13:24.422698,2020-10-09 14:14:04.985038,0 days 00:00:40.562340000,256.0,0.1,0.00023064070806028665,linear_with_warmup,1.0,8.0,192.0,7.739219663603109e-05,"Trial 204 failed, because the returned value from the objective function cannot be cast to float. Returned value is: None",FAIL
205,,2020-10-09 14:13:43.530621,2020-10-09 14:14:20.116185,0 days 00:00:36.585564000,256.0,0.1,0.0002572216138300101,linear_with_warmup,1.0,8.0,192.0,7.699954411058439e-05,"Trial 205 failed, because the returned value from the objective function cannot be cast to float. Returned value is: None",FAIL
206,,2020-10-09 17:47:57.851904,,,,0.1,0.00013543937984802635,,,,,8.228803843475838e-05,,RUNNING
207,,2020-10-09 17:47:58.833104,,,,,,,,,,,,RUNNING
208,,2020-10-09 17:47:59.009683,,,256.0,,,,,,,,,RUNNING
209,,2020-10-09 17:47:59.116756,,,,,,linear_with_warmup,2.0,5.0,192.0,,,RUNNING
210,,2020-10-09 17:47:59.229369,,,,,,,,,,,,RUNNING
211,0.19021243336630733,2020-10-09 17:49:33.489685,2020-10-09 20:23:53.773479,0 days 02:34:20.283794000,256.0,0.1,0.0001318133435515665,linear_with_warmup,2.0,5.0,192.0,2.8519307612755786e-05,,COMPLETE
212,0.18196399216366338,2020-10-09 17:49:33.621970,2020-10-09 20:07:45.127882,0 days 02:18:11.505912000,128.0,0.1,0.00022105045532547012,linear_with_warmup,2.0,5.0,192.0,9.960331209659224e-05,,COMPLETE
213,0.18516061338503498,2020-10-09 17:49:33.747348,2020-10-09 21:40:26.095803,0 days 03:50:52.348455000,128.0,0.1,0.00013870115463444655,linear_with_warmup,2.0,9.0,192.0,6.957819887086187e-05,,COMPLETE
214,0.21458268066955205,2020-10-09 17:49:33.914914,2020-10-09 20:33:09.707122,0 days 02:43:35.792208000,256.0,0.1,0.00022727911120729163,linear_with_warmup,2.0,5.0,192.0,3.0360824955891356e-05,,COMPLETE
215,0.15892026144934412,2020-10-09 17:49:34.647756,2020-10-09 20:07:24.775232,0 days 02:17:50.127476000,128.0,0.1,0.00013208121021630894,linear_with_warmup,2.0,5.0,192.0,3.016797141522129e-05,,COMPLETE
216,0.23221675541339784,2020-10-09 20:07:25.439760,2020-10-10 00:14:48.936839,0 days 04:07:23.497079000,256.0,0.1,0.0002253938679358956,cosine_with_warmup,2.0,9.0,192.0,7.997313433207097e-05,,COMPLETE
217,0.250296974026406,2020-10-09 20:07:45.872692,2020-10-09 23:58:00.217121,0 days 03:50:14.344429000,256.0,0.1,0.0002808884197397779,cosine_with_warmup,1.0,9.0,192.0,1.0064916632837005e-06,,COMPLETE
218,0.2580430761357895,2020-10-09 20:23:54.519307,2020-10-10 00:20:43.744575,0 days 03:56:49.225268000,256.0,0.1,0.0002985327010103303,constant_with_warmup,1.0,9.0,192.0,7.39574868460765e-05,,COMPLETE
219,0.2559006612802405,2020-10-09 20:33:10.995835,2020-10-10 00:57:35.022270,0 days 04:24:24.026435000,256.0,0.1,0.00032500827901440045,constant_with_warmup,1.0,9.0,128.0,7.659098804783413e-05,,COMPLETE
220,0.25687555555595604,2020-10-09 21:40:26.830441,2020-10-10 02:13:20.150553,0 days 04:32:53.320112000,256.0,0.1,0.00030078361814408615,constant_with_warmup,1.0,9.0,128.0,7.766784069564626e-05,,COMPLETE
221,0.2565535318156282,2020-10-09 23:58:02.232881,2020-10-10 04:24:55.242276,0 days 04:26:53.009395000,256.0,0.0,0.0003001763508168728,constant_with_warmup,1.0,9.0,128.0,5.929945291052876e-05,,COMPLETE
222,0.25591915806199955,2020-10-10 00:14:49.631479,2020-10-10 05:25:57.413329,0 days 05:11:07.781850000,256.0,0.0,0.0003016875093753616,constant_with_warmup,1.0,10.0,128.0,5.724988082191387e-05,,COMPLETE
223,0.25783068027690076,2020-10-10 00:20:44.904525,2020-10-10 04:59:33.574656,0 days 04:38:48.670131000,320.0,0.0,0.0002783316906088247,constant_with_warmup,1.0,10.0,256.0,5.593904315330903e-05,,COMPLETE
224,0.25120067336950924,2020-10-10 00:57:36.233772,2020-10-10 07:20:19.153045,0 days 06:22:42.919273000,320.0,0.0,0.00038808298969097743,constant_with_warmup,1.0,10.0,192.0,4.012540949638106e-05,,COMPLETE
225,0.24359956122549034,2020-10-10 02:13:20.995202,2020-10-10 08:25:17.050729,0 days 06:11:56.055527000,320.0,0.0,0.0006664192513336858,constant_with_warmup,1.0,10.0,256.0,3.9686166995447844e-05,,COMPLETE
226,0.2587966714979325,2020-10-10 04:24:57.439998,2020-10-10 08:50:01.421430,0 days 04:25:03.981432000,320.0,0.2,0.00019114051514137684,constant_with_warmup,1.0,10.0,256.0,3.7781226852132216e-05,,COMPLETE
227,0.2507418332973429,2020-10-10 04:59:34.587402,2020-10-10 09:42:06.499125,0 days 04:42:31.911723000,320.0,0.0,0.00039482332752895647,constant_with_warmup,1.0,10.0,192.0,3.859575439110032e-05,,COMPLETE
228,0.2526546689897749,2020-10-10 05:25:58.973330,2020-10-10 09:57:08.930069,0 days 04:31:09.956739000,320.0,0.0,0.00041724404405409077,constant_with_warmup,1.0,10.0,256.0,3.919442536692006e-05,,COMPLETE
229,0.2451952800732299,2020-10-10 07:20:20.082730,2020-10-10 12:03:30.810579,0 days 04:43:10.727849000,320.0,0.2,0.0006097758246392577,constant_with_warmup,1.0,10.0,256.0,9.818044692575701e-05,,COMPLETE
230,0.2557493143191076,2020-10-10 08:25:18.237790,2020-10-10 11:56:09.999337,0 days 03:30:51.761547000,320.0,0.3,0.00039493045033225384,constant_with_warmup,1.0,8.0,256.0,9.823966906395258e-05,,COMPLETE
231,0.2536590845983176,2020-10-10 08:50:02.138275,2020-10-10 13:36:22.374917,0 days 04:46:20.236642000,320.0,0.3,0.0003925730678721043,constant_with_warmup,1.0,10.0,256.0,8.545323201170787e-05,,COMPLETE
232,0.25900339363878727,2020-10-10 09:42:07.335813,2020-10-10 14:22:58.007518,0 days 04:40:50.671705000,320.0,0.3,0.00021068486367901767,constant_with_warmup,1.0,10.0,256.0,8.727130643495557e-05,,COMPLETE
233,0.25903001599927844,2020-10-10 09:57:11.229926,2020-10-10 14:32:37.997979,0 days 04:35:26.768053000,320.0,0.2,0.00020038676102340788,constant_with_warmup,1.0,10.0,256.0,8.550586185545568e-05,,COMPLETE
234,0.2590633649025301,2020-10-10 11:56:10.447465,2020-10-10 16:37:14.828244,0 days 04:41:04.380779000,320.0,0.2,0.0002024939202283675,constant_with_warmup,1.0,10.0,256.0,9.065312473196671e-05,,COMPLETE
235,0.2581878593149488,2020-10-10 12:03:31.725182,2020-10-10 16:06:10.696547,0 days 04:02:38.971365000,320.0,0.2,0.00020405220917875643,constant_with_warmup,1.0,9.0,256.0,8.398037189876881e-05,,COMPLETE
236,0.258212597605603,2020-10-10 13:36:22.896526,2020-10-10 17:34:40.084575,0 days 03:58:17.188049000,320.0,0.2,0.00019653119870417072,constant_with_warmup,1.0,9.0,256.0,5.218543122740101e-05,,COMPLETE
237,0.25758505689830374,2020-10-10 14:22:58.600245,2020-10-10 18:22:27.574126,0 days 03:59:28.973881000,320.0,0.3,0.00018611493184403856,constant_with_warmup,1.0,9.0,256.0,5.685402598546695e-05,,COMPLETE
238,0.2589069201450048,2020-10-10 14:32:38.920198,2020-10-10 19:09:44.888380,0 days 04:37:05.968182000,320.0,0.3,0.00019524458247500835,constant_with_warmup,1.0,10.0,256.0,6.471724512671733e-05,,COMPLETE
239,0.2590191882845147,2020-10-10 16:06:12.682598,2020-10-10 20:57:53.125007,0 days 04:51:40.442409000,320.0,0.2,0.00019791167901057717,constant_with_warmup,1.0,10.0,256.0,5.3231640099172565e-05,,COMPLETE
240,,2020-10-10 16:37:15.364066,2020-10-10 16:39:04.502996,0 days 00:01:49.138930000,320.0,0.2,0.00020518621349008176,constant_with_warmup,1.0,10.0,256.0,8.460109258422048e-05,"Trial 240 failed, because the returned value from the objective function cannot be cast to float. Returned value is: None",FAIL
241,0.2588629306708529,2020-10-10 16:39:05.124020,2020-10-10 21:16:35.180394,0 days 04:37:30.056374000,320.0,0.2,0.0001962537491953466,constant_with_warmup,1.0,10.0,256.0,8.946014376254748e-05,,COMPLETE
242,0.2565985162866592,2020-10-10 17:34:40.981139,2020-10-10 22:17:32.408160,0 days 04:42:51.427021000,320.0,0.2,0.00015308461393569753,constant_with_warmup,1.0,10.0,256.0,8.668056269718039e-05,,COMPLETE
243,0.25734121102063406,2020-10-10 18:22:28.935161,2020-10-10 23:04:46.328231,0 days 04:42:17.393070000,320.0,0.2,0.00015582528731903484,constant_with_warmup,1.0,10.0,256.0,8.702409404259268e-05,,COMPLETE
244,0.2568124725809559,2020-10-10 19:09:46.613096,2020-10-10 23:51:02.332341,0 days 04:41:15.719245000,320.0,0.2,0.00015312766658803027,constant_with_warmup,1.0,10.0,256.0,8.774005543383162e-05,,COMPLETE
245,0.25338614739711657,2020-10-10 20:57:54.004984,2020-10-11 02:01:07.122006,0 days 05:03:13.117022000,320.0,0.2,0.00011800264422018123,constant_with_warmup,1.0,10.0,256.0,3.2088244806816074e-06,,COMPLETE
246,0.23339000035739335,2020-10-10 21:16:36.510394,2020-10-11 02:28:20.799834,0 days 05:11:44.289440000,320.0,0.2,0.00011870320118701019,constant_with_warmup,3.0,10.0,256.0,5.179029635916571e-05,,COMPLETE
247,0.23144133761335586,2020-10-10 22:17:33.583406,2020-10-11 03:43:37.869936,0 days 05:26:04.286530000,320.0,0.3,0.00011628139516490067,constant_with_warmup,3.0,10.0,256.0,8.484405254372581e-06,,COMPLETE
248,0.24314995757550717,2020-10-10 23:04:48.707563,2020-10-11 04:20:03.066594,0 days 05:15:14.359031000,320.0,0.3,0.00019286799152929386,constant_with_warmup,3.0,10.0,256.0,7.972624975203945e-06,,COMPLETE
249,0.2585245579368099,2020-10-10 23:51:04.069530,2020-10-11 04:37:55.947426,0 days 04:46:51.877896000,320.0,0.2,0.00018816525761492224,constant_with_warmup,1.0,10.0,256.0,5.219774027314118e-05,,COMPLETE
250,0.2468318191578694,2020-10-11 02:01:08.251192,2020-10-11 07:34:09.161687,0 days 05:33:00.910495000,320.0,0.2,0.00019539714847340204,constant_with_warmup,3.0,10.0,256.0,5.195663866201057e-05,,COMPLETE
251,0.25867978173266554,2020-10-11 02:28:21.212654,2020-10-11 07:14:14.061364,0 days 04:45:52.848710000,320.0,0.3,0.00019425416577711473,constant_with_warmup,1.0,10.0,256.0,6.428135604173956e-05,,COMPLETE
252,0.25843862248905747,2020-10-11 03:43:38.682797,2020-10-11 08:30:53.701071,0 days 04:47:15.018274000,320.0,0.2,0.00019255521415847097,constant_with_warmup,1.0,10.0,256.0,6.572789578743434e-05,,COMPLETE
253,0.25809199450082937,2020-10-11 04:20:04.067403,2020-10-11 08:18:43.449718,0 days 03:58:39.382315000,320.0,0.2,0.0001910435111363894,constant_with_warmup,1.0,9.0,256.0,6.554814252563293e-05,,COMPLETE
254,0.2421571637527566,2020-10-11 04:37:58.040079,2020-10-11 06:51:21.038161,0 days 02:13:22.998082000,320.0,0.2,0.00019424386576302966,constant_with_warmup,1.0,4.0,256.0,6.589392275785553e-05,,COMPLETE
255,0.25843234500045675,2020-10-11 06:51:22.251781,2020-10-11 11:38:26.334157,0 days 04:47:04.082376000,320.0,0.2,0.0001773808588130416,constant_with_warmup,1.0,10.0,256.0,5.18779414348595e-05,,COMPLETE
256,0.2587800498589219,2020-10-11 07:14:17.572079,2020-10-11 11:57:06.200022,0 days 04:42:48.627943000,320.0,0.3,0.00023775574907545,constant_with_warmup,1.0,10.0,256.0,4.419061020250172e-05,,COMPLETE
257,0.25664504121410053,2020-10-11 07:34:09.930779,2020-10-11 12:22:37.712019,0 days 04:48:27.781240000,320.0,0.3,0.000145673827224964,constant_with_warmup,1.0,10.0,256.0,3.3564609018731414e-05,,COMPLETE
258,0.25842248384507893,2020-10-11 08:18:45.357274,2020-10-11 12:59:08.114827,0 days 04:40:22.757553000,320.0,0.3,0.00023616855266959271,constant_with_warmup,1.0,10.0,256.0,1.7839079597029874e-05,,COMPLETE
259,0.258301265798775,2020-10-11 08:30:54.827501,2020-10-11 13:11:41.479815,0 days 04:40:46.652314000,320.0,0.3,0.00024043004949145767,constant_with_warmup,1.0,10.0,256.0,4.1799858014801316e-05,,COMPLETE
260,0.25833773390470455,2020-10-11 11:38:27.021872,2020-10-11 17:23:28.878300,0 days 05:45:01.856428000,320.0,0.3,0.00023601535260215644,constant_with_warmup,1.0,10.0,256.0,6.49712384517021e-05,,COMPLETE
261,0.25856405385348397,2020-10-11 11:57:06.725650,2020-10-11 17:22:52.121665,0 days 05:25:45.396015000,320.0,0.3,0.0002353701491643814,constant_with_warmup,1.0,10.0,256.0,4.1753904442990545e-05,,COMPLETE
262,0.2584030448225663,2020-10-11 12:22:38.578464,2020-10-11 18:01:11.412148,0 days 05:38:32.833684000,320.0,0.3,0.00024103581824596836,constant_with_warmup,1.0,10.0,256.0,4.3799879573080066e-05,,COMPLETE
