number,value,datetime_start,datetime_complete,duration,params_--d_model,params_--dropout,params_--learning_rate,params_--learning_rate_schedule,params_--n_layer,params_--num_train_epochs,params_--per_device_train_batch_size,params_--weight_decay,system_attrs_fail_reason,state
88,,2020-10-07 16:45:54.529006,2020-10-07 21:26:57.666119,0 days 04:41:03.137113000,320.0,0.0,0.0005958560404021855,constant_with_warmup,1.0,10.0,128.0,3.655536704750008e-05,"Trial 88 failed, because the returned value from the objective function cannot be cast to float. Returned value is: None",FAIL
89,,2020-10-07 16:45:54.688492,2020-10-07 21:26:48.814628,0 days 04:40:54.126136000,320.0,0.0,0.008044078797744868,constant_with_warmup,4.0,10.0,128.0,3.8307604748759646e-05,"Trial 89 failed, because the returned value from the objective function cannot be cast to float. Returned value is: None",FAIL
90,,2020-10-07 16:45:54.850767,2020-10-07 21:26:49.488094,0 days 04:40:54.637327000,320.0,0.0,0.009955307613623534,constant_with_warmup,1.0,10.0,128.0,3.795654667984762e-05,"Trial 90 failed, because the returned value from the objective function cannot be cast to float. Returned value is: None",FAIL
91,,2020-10-07 16:45:54.923564,2020-10-08 00:35:27.673512,0 days 07:49:32.749948000,320.0,0.0,0.0005330965985113411,constant_with_warmup,1.0,10.0,128.0,3.561439526381301e-05,"Trial 91 failed, because the returned value from the objective function cannot be cast to float. Returned value is: None",FAIL
92,,2020-10-07 21:26:49.495940,2020-10-08 01:33:36.745187,0 days 04:06:47.249247000,320.0,0.0,0.009695145384226419,constant_with_warmup,1.0,10.0,128.0,3.537073802894199e-05,"Trial 92 failed, because the returned value from the objective function cannot be cast to float. Returned value is: None",FAIL
93,,2020-10-07 21:26:49.786440,2020-10-07 22:49:11.420017,0 days 01:22:21.633577000,320.0,0.0,0.0005536498014127455,constant_with_warmup,1.0,10.0,128.0,3.549860060732198e-05,"Trial 93 failed, because the returned value from the objective function cannot be cast to float. Returned value is: None",FAIL
94,,2020-10-07 21:26:57.881546,2020-10-07 22:49:22.139792,0 days 01:22:24.258246000,128.0,0.0,0.00854566824320901,constant_with_warmup,1.0,10.0,128.0,3.367054585052037e-05,"Trial 94 failed, because the returned value from the objective function cannot be cast to float. Returned value is: None",FAIL
95,,2020-10-07 22:49:12.477166,2020-10-07 22:49:52.849107,0 days 00:00:40.371941000,320.0,0.0,0.0005448532268337601,constant_with_warmup,1.0,10.0,128.0,3.638522123532019e-05,"Trial 95 failed, because the returned value from the objective function cannot be cast to float. Returned value is: None",FAIL
96,,2020-10-07 22:49:22.660162,2020-10-07 22:50:00.167583,0 days 00:00:37.507421000,320.0,0.0,0.009159408368254289,constant_with_warmup,1.0,10.0,128.0,3.508396566622777e-05,"Trial 96 failed, because the returned value from the objective function cannot be cast to float. Returned value is: None",FAIL
97,,2020-10-07 22:49:53.375120,2020-10-07 22:54:01.316215,0 days 00:04:07.941095000,320.0,0.0,0.009068555393791833,constant_with_warmup,1.0,10.0,128.0,3.4775171878537876e-05,"Trial 97 failed, because the returned value from the objective function cannot be cast to float. Returned value is: None",FAIL
98,,2020-10-07 22:50:01.050077,2020-10-07 22:54:00.797971,0 days 00:03:59.747894000,320.0,0.0,0.0004821505152340019,constant_with_warmup,1.0,10.0,128.0,3.721000058026739e-05,"Trial 98 failed, because the returned value from the objective function cannot be cast to float. Returned value is: None",FAIL
99,,2020-10-07 22:54:00.953336,2020-10-08 02:35:47.477256,0 days 03:41:46.523920000,320.0,0.0,0.0006226818234123367,constant_with_warmup,1.0,10.0,128.0,4.018744941219375e-05,"Trial 99 failed, because the returned value from the objective function cannot be cast to float. Returned value is: None",FAIL
100,,2020-10-07 22:54:02.544527,2020-10-08 02:27:56.637712,0 days 03:33:54.093185000,320.0,0.0,0.009572999850031844,constant_with_warmup,1.0,10.0,128.0,3.6744682228383764e-05,"Trial 100 failed, because the returned value from the objective function cannot be cast to float. Returned value is: None",FAIL
101,,2020-10-08 00:35:28.309963,2020-10-08 00:36:04.973473,0 days 00:00:36.663510000,320.0,0.0,0.0006035373013105565,constant_with_warmup,1.0,10.0,128.0,3.820516206690561e-05,"Trial 101 failed, because the returned value from the objective function cannot be cast to float. Returned value is: None",FAIL
102,,2020-10-08 00:36:05.492293,2020-10-08 00:36:45.194547,0 days 00:00:39.702254000,320.0,0.0,0.008955268949050674,constant_with_warmup,1.0,10.0,128.0,3.563142672926587e-05,"Trial 102 failed, because the returned value from the objective function cannot be cast to float. Returned value is: None",FAIL
103,,2020-10-08 00:36:45.841060,2020-10-08 00:42:15.595466,0 days 00:05:29.754406000,320.0,0.0,0.007917120155196829,constant_with_warmup,1.0,10.0,128.0,3.612039415185138e-05,"Trial 103 failed, because the returned value from the objective function cannot be cast to float. Returned value is: None",FAIL
104,,2020-10-08 00:42:06.997540,2020-10-08 00:43:06.363165,0 days 00:00:59.365625000,320.0,0.0,0.008768009303623717,constant_with_warmup,1.0,10.0,128.0,4.451772206091964e-05,"Trial 104 failed, because the returned value from the objective function cannot be cast to float. Returned value is: None",FAIL
105,,2020-10-08 00:42:16.065666,2020-10-08 03:48:55.141371,0 days 03:06:39.075705000,320.0,0.0,0.009135891850495558,constant_with_warmup,1.0,10.0,128.0,3.416388128035845e-05,"Trial 105 failed, because the returned value from the objective function cannot be cast to float. Returned value is: None",FAIL
106,,2020-10-08 00:43:06.704530,2020-10-08 00:43:49.947779,0 days 00:00:43.243249000,320.0,0.0,0.009918540127687425,constant_with_warmup,1.0,10.0,128.0,4.0894950089863715e-05,"Trial 106 failed, because the returned value from the objective function cannot be cast to float. Returned value is: None",FAIL
107,,2020-10-08 00:43:50.526617,2020-10-08 00:44:23.480422,0 days 00:00:32.953805000,320.0,0.0,0.008561120410787007,constant_with_warmup,1.0,10.0,128.0,3.314383395137124e-05,"Trial 107 failed, because the returned value from the objective function cannot be cast to float. Returned value is: None",FAIL
108,,2020-10-08 00:44:24.782309,2020-10-08 05:17:23.972939,0 days 04:32:59.190630000,320.0,0.0,0.009504734979239628,constant_with_warmup,1.0,10.0,128.0,4.384675082679194e-05,"Trial 108 failed, because the returned value from the objective function cannot be cast to float. Returned value is: None",FAIL
109,,2020-10-08 01:33:37.149390,2020-10-08 01:34:15.316665,0 days 00:00:38.167275000,320.0,0.0,0.008837060849100551,constant_with_warmup,1.0,10.0,128.0,3.368211381737597e-05,"Trial 109 failed, because the returned value from the objective function cannot be cast to float. Returned value is: None",FAIL
110,,2020-10-08 01:34:16.521509,2020-10-08 01:34:55.089860,0 days 00:00:38.568351000,320.0,0.0,0.0005788741841909004,constant_with_warmup,1.0,10.0,128.0,3.7565534137558975e-05,"Trial 110 failed, because the returned value from the objective function cannot be cast to float. Returned value is: None",FAIL
111,,2020-10-08 01:34:56.330201,2020-10-08 01:35:35.980729,0 days 00:00:39.650528000,320.0,0.0,0.008554084437823078,constant_with_warmup,1.0,10.0,128.0,3.253055086348261e-05,"Trial 111 failed, because the returned value from the objective function cannot be cast to float. Returned value is: None",FAIL
112,,2020-10-08 01:35:36.378864,2020-10-08 01:36:21.187116,0 days 00:00:44.808252000,320.0,0.0,0.009748661692037005,constant_with_warmup,1.0,10.0,128.0,3.539596543978514e-05,"Trial 112 failed, because the returned value from the objective function cannot be cast to float. Returned value is: None",FAIL
113,,2020-10-08 01:36:21.578313,2020-10-08 01:43:06.380138,0 days 00:06:44.801825000,320.0,0.0,0.0006549728833720576,constant_with_warmup,1.0,10.0,128.0,3.914345652668562e-05,"Trial 113 failed, because the returned value from the objective function cannot be cast to float. Returned value is: None",FAIL
114,0.07604935072501652,2020-10-08 01:43:06.802814,2020-10-08 07:45:49.331698,0 days 06:02:42.528884000,320.0,0.0,0.008906727654253106,constant_with_warmup,1.0,10.0,128.0,3.8290133349293075e-05,,COMPLETE
115,,2020-10-08 02:27:57.090998,2020-10-08 02:28:37.111824,0 days 00:00:40.020826000,320.0,0.0,0.008574755002455157,constant_with_warmup,1.0,10.0,128.0,3.904952075245803e-05,"Trial 115 failed, because the returned value from the objective function cannot be cast to float. Returned value is: None",FAIL
116,,2020-10-08 02:28:37.453516,2020-10-08 02:29:20.815181,0 days 00:00:43.361665000,320.0,0.0,0.0006683749994536271,constant_with_warmup,1.0,10.0,128.0,3.332204767379259e-05,"Trial 116 failed, because the returned value from the objective function cannot be cast to float. Returned value is: None",FAIL
117,0.24178931776737972,2020-10-08 02:29:21.373413,2020-10-08 06:58:20.093635,0 days 04:28:58.720222000,320.0,0.0,0.0005645521425081986,constant_with_warmup,1.0,9.0,128.0,3.585682706468483e-05,,COMPLETE
118,,2020-10-08 02:35:48.451275,2020-10-08 02:36:34.161808,0 days 00:00:45.710533000,320.0,0.0,0.008225860421582906,constant_with_warmup,1.0,10.0,128.0,3.834854256943001e-05,"Trial 118 failed, because the returned value from the objective function cannot be cast to float. Returned value is: None",FAIL
119,,2020-10-08 02:36:34.754694,2020-10-08 02:37:15.114689,0 days 00:00:40.359995000,320.0,0.0,0.009672050872540607,constant_with_warmup,1.0,10.0,128.0,3.688586500577175e-05,"Trial 119 failed, because the returned value from the objective function cannot be cast to float. Returned value is: None",FAIL
120,,2020-10-08 02:37:16.103920,2020-10-08 02:41:33.826057,0 days 00:04:17.722137000,320.0,0.0,0.009546387920569268,constant_with_warmup,1.0,10.0,128.0,3.435340971956758e-05,"Trial 120 failed, because the returned value from the objective function cannot be cast to float. Returned value is: None",FAIL
121,,2020-10-08 02:41:34.534785,2020-10-08 02:42:14.410497,0 days 00:00:39.875712000,128.0,0.0,0.0005882497443464225,constant_with_warmup,1.0,10.0,128.0,3.889889328149049e-05,"Trial 121 failed, because the returned value from the objective function cannot be cast to float. Returned value is: None",FAIL
122,0.24545478591401254,2020-10-08 02:42:15.047973,2020-10-08 08:05:12.789849,0 days 05:22:57.741876000,320.0,0.0,0.0004393446855628905,constant_with_warmup,1.0,10.0,128.0,3.678641241999887e-05,,COMPLETE
123,0.2425663977127952,2020-10-08 03:48:55.478288,2020-10-08 09:33:53.965017,0 days 05:44:58.486729000,320.0,0.0,0.0004996873919606454,constant_with_warmup,1.0,10.0,128.0,3.508019335289595e-05,,COMPLETE
124,,2020-10-08 05:17:24.632076,2020-10-08 06:44:27.288467,0 days 01:27:02.656391000,320.0,0.0,0.008970613901631364,constant_with_warmup,1.0,10.0,128.0,3.809562756892971e-05,"Trial 124 failed, because the returned value from the objective function cannot be cast to float. Returned value is: None",FAIL
125,,2020-10-08 06:44:27.767663,2020-10-08 07:47:32.112259,0 days 01:03:04.344596000,320.0,0.0,0.00867732485289806,constant_with_warmup,1.0,10.0,128.0,4.0505055563125125e-05,"Trial 125 failed, because the returned value from the objective function cannot be cast to float. Returned value is: None",FAIL
126,0.06994736362984715,2020-10-08 06:58:20.955815,2020-10-08 12:10:17.845706,0 days 05:11:56.889891000,320.0,0.0,0.009092251425206008,constant_with_warmup,1.0,10.0,128.0,2.9920186152083157e-05,,COMPLETE
127,0.23788665951558063,2020-10-08 07:45:49.741601,2020-10-08 12:36:37.993706,0 days 04:50:48.252105000,320.0,0.1,0.0005445609536299183,constant_with_warmup,4.0,8.0,128.0,9.036350994130139e-05,,COMPLETE
128,0.2420925618962196,2020-10-08 07:47:32.264398,2020-10-08 12:40:40.159393,0 days 04:53:07.894995000,320.0,0.1,0.00043109715174239775,constant_with_warmup,4.0,8.0,128.0,9.281524909865991e-05,,COMPLETE
129,0.24798040377075942,2020-10-08 08:05:13.190835,2020-10-08 13:57:04.391617,0 days 05:51:51.200782000,320.0,0.1,0.00045901880416012857,constant_with_warmup,1.0,8.0,128.0,8.910439868203664e-05,,COMPLETE
130,,2020-10-08 09:33:56.273925,2020-10-08 09:34:07.476605,0 days 00:00:11.202680000,320.0,0.1,0.000333011943947487,constant_with_warmup,1.0,8.0,128.0,9.840851305340684e-05,"Trial 130 failed because of the following error: KeyError(<autobench.core.job.Job object at 0x7f2bd7534da0>,)",FAIL
131,,2020-10-08 09:34:08.029268,,,,,,,,,,,,RUNNING
132,,2020-10-08 12:10:18.395229,,,,,,,,,,,,RUNNING
133,,2020-10-08 12:36:38.775655,,,,,,,,,,,,RUNNING
134,,2020-10-08 12:40:40.586637,,,,,,,,,,,,RUNNING
135,,2020-10-08 13:57:05.069712,,,,,,,,,,,,RUNNING
136,0.2547676828318714,2020-10-08 15:52:15.406764,2020-10-08 20:57:23.749071,0 days 05:05:08.342307000,256.0,0.1,0.00036262967400378106,constant_with_warmup,1.0,9.0,128.0,7.255911625243644e-05,,COMPLETE
137,0.25487586184820976,2020-10-08 15:52:16.585167,2020-10-08 20:13:22.035967,0 days 04:21:05.450800000,256.0,0.1,0.00034524525658617244,constant_with_warmup,1.0,9.0,128.0,5.837352334766025e-05,,COMPLETE
138,0.25475363182457283,2020-10-08 15:52:16.964369,2020-10-08 20:09:24.425251,0 days 04:17:07.460882000,256.0,0.1,0.000345614317629697,constant_with_warmup,1.0,9.0,128.0,6.375026965831876e-05,,COMPLETE
139,0.2569465897233748,2020-10-08 15:52:17.439507,2020-10-08 20:09:53.690390,0 days 04:17:36.250883000,256.0,0.1,0.00030039583022892815,constant_with_warmup,1.0,9.0,128.0,5.8167986188472045e-05,,COMPLETE
140,0.25580590488664756,2020-10-08 15:52:18.534803,2020-10-08 21:22:43.135937,0 days 05:30:24.601134000,256.0,0.1,0.0003217653339783835,constant_with_warmup,1.0,9.0,128.0,6.439342526820943e-05,,COMPLETE
141,0.2566160931798782,2020-10-08 20:09:26.157478,2020-10-09 01:07:34.889532,0 days 04:58:08.732054000,256.0,0.1,0.000253519506043236,constant_with_warmup,1.0,8.0,64.0,7.298012628053767e-05,,COMPLETE
142,0.25729350802868906,2020-10-08 20:09:54.200005,2020-10-09 01:06:35.968770,0 days 04:56:41.768765000,256.0,0.1,0.00022717576928144451,constant_with_warmup,1.0,8.0,64.0,6.363063057360243e-05,,COMPLETE
143,0.2561019624911632,2020-10-08 20:13:23.309044,2020-10-09 01:45:31.482718,0 days 05:32:08.173674000,256.0,0.1,0.00025479042613617227,constant_with_warmup,1.0,9.0,64.0,6.36374050535582e-05,,COMPLETE
144,0.2527851787863416,2020-10-08 20:57:24.434206,2020-10-09 02:42:24.806495,0 days 05:45:00.372289000,256.0,0.1,0.00020525409010583974,constant_with_warmup,2.0,8.0,64.0,5.983599981485347e-05,,COMPLETE
145,,2020-10-08 21:22:44.179491,2020-10-08 23:49:38.128180,0 days 02:26:53.948689000,256.0,0.1,0.00018776725941527844,cosine_with_warmup,2.0,7.0,64.0,1.01073387299985e-05,"Trial 145 failed, because the returned value from the objective function cannot be cast to float. Returned value is: None",FAIL
146,,2020-10-08 23:49:39.686534,2020-10-08 23:57:08.735414,0 days 00:07:29.048880000,256.0,0.1,0.000178712081964777,cosine_with_warmup,2.0,7.0,64.0,1.0742435118031371e-05,"Trial 146 failed, because the returned value from the objective function cannot be cast to float. Returned value is: None",FAIL
147,,2020-10-08 23:57:09.670523,2020-10-09 00:05:10.034770,0 days 00:08:00.364247000,256.0,0.1,0.00018755331424800652,cosine_with_warmup,2.0,7.0,64.0,1.1381674062029468e-05,"Trial 147 failed, because the returned value from the objective function cannot be cast to float. Returned value is: None",FAIL
148,0.2344995499841108,2020-10-09 00:05:10.778312,2020-10-09 04:53:26.268656,0 days 04:48:15.490344000,256.0,0.1,0.00017078915212615872,cosine_with_warmup,2.0,7.0,64.0,9.423552962750876e-06,,COMPLETE
149,0.250383976367509,2020-10-09 01:06:36.841964,2020-10-09 05:43:49.844501,0 days 04:37:13.002537000,256.0,0.1,0.00017687041165099747,constant_with_warmup,2.0,7.0,64.0,1.2381677887998602e-05,,COMPLETE
150,0.22021005909497604,2020-10-09 01:07:36.946402,2020-10-09 05:31:08.077949,0 days 04:23:31.131547000,192.0,0.2,0.0001615033493277612,cosine_with_warmup,2.0,7.0,64.0,2.1529374792921226e-05,,COMPLETE
151,0.24527691359792708,2020-10-09 01:45:32.277557,2020-10-09 06:00:55.809716,0 days 04:15:23.532159000,192.0,0.1,0.0001791359781919862,constant_with_warmup,2.0,7.0,64.0,2.4236939643772482e-05,,COMPLETE
152,0.2531040913132093,2020-10-09 02:42:25.209070,2020-10-09 06:48:46.692330,0 days 04:06:21.483260000,192.0,0.2,0.00016199279635528672,constant_with_warmup,1.0,7.0,64.0,2.377151892888024e-05,,COMPLETE
153,0.24539597616179004,2020-10-09 04:53:27.683082,2020-10-09 08:59:43.028930,0 days 04:06:15.345848000,192.0,0.2,0.00010018308802530148,constant_with_warmup,1.0,7.0,64.0,2.4287151297963564e-05,,COMPLETE
154,0.246625372132189,2020-10-09 05:31:09.599369,2020-10-09 09:37:18.948010,0 days 04:06:09.348641000,192.0,0.1,0.00010682813575450475,constant_with_warmup,1.0,7.0,64.0,4.645973736602188e-05,,COMPLETE
155,0.24234154196698224,2020-10-09 05:43:50.274921,2020-10-09 09:37:48.265369,0 days 03:53:57.990448000,192.0,0.2,0.00010498656890186126,constant_with_warmup,1.0,6.0,64.0,4.801684291025459e-05,,COMPLETE
156,0.255293831957828,2020-10-09 06:00:56.167407,2020-10-09 10:00:38.190727,0 days 03:59:42.023320000,192.0,0.2,0.00025213444133799517,constant_with_warmup,1.0,6.0,64.0,5.0344507652680436e-05,,COMPLETE
157,0.2484650991302966,2020-10-09 06:48:47.665358,2020-10-09 10:44:01.290294,0 days 03:55:13.624936000,256.0,0.1,0.00010082642404504167,constant_with_warmup,1.0,6.0,64.0,4.649807700025786e-05,,COMPLETE
158,0.23650085271907909,2020-10-09 08:59:43.580297,2020-10-09 12:51:43.812291,0 days 03:52:00.231994000,256.0,0.1,0.0007998946799606816,constant_with_warmup,1.0,6.0,64.0,4.499150421383746e-05,,COMPLETE
159,0.23418961398279128,2020-10-09 09:37:19.516465,2020-10-09 13:26:31.729034,0 days 03:49:12.212569000,256.0,0.1,0.0008633467504215277,constant_with_warmup,1.0,6.0,64.0,4.815639697129308e-05,,COMPLETE
160,0.2292228134634753,2020-10-09 09:37:49.182864,2020-10-09 14:32:30.401088,0 days 04:54:41.218224000,256.0,0.1,0.0008795914262060134,constant_with_warmup,1.0,8.0,64.0,9.939741973885454e-05,,COMPLETE
161,0.257865327398817,2020-10-09 10:00:39.236563,2020-10-09 14:10:07.947292,0 days 04:09:28.710729000,256.0,0.1,0.0002616186022761845,constant_with_warmup,1.0,8.0,192.0,7.484218315299636e-05,,COMPLETE
162,0.24416063624001386,2020-10-09 10:44:01.926742,2020-10-09 14:30:23.088166,0 days 03:46:21.161424000,256.0,0.1,0.0008238717604493042,constant_with_warmup,1.0,8.0,192.0,7.432335503798969e-05,,COMPLETE
163,,2020-10-09 12:51:45.909783,2020-10-09 14:00:19.635860,0 days 01:08:33.726077000,256.0,0.1,0.00024405247058748345,constant_with_warmup,1.0,8.0,192.0,7.22224666265653e-05,"Trial 163 failed, because the returned value from the objective function cannot be cast to float. Returned value is: None",FAIL
164,,2020-10-09 13:26:32.215483,2020-10-09 14:00:44.341568,0 days 00:34:12.126085000,256.0,0.1,0.0002697270905563368,linear_with_warmup,1.0,8.0,192.0,6.925246861811552e-05,"Trial 164 failed, because the returned value from the objective function cannot be cast to float. Returned value is: None",FAIL
165,,2020-10-09 14:00:20.364177,2020-10-09 14:01:01.994596,0 days 00:00:41.630419000,256.0,0.1,0.0002705557811703819,constant_with_warmup,1.0,8.0,192.0,7.269791266181246e-05,"Trial 165 failed, because the returned value from the objective function cannot be cast to float. Returned value is: None",FAIL
166,,2020-10-09 14:00:44.739287,2020-10-09 14:01:28.526264,0 days 00:00:43.786977000,256.0,0.1,0.00024573925505204765,linear_with_warmup,1.0,8.0,192.0,9.935553974735056e-05,"Trial 166 failed, because the returned value from the objective function cannot be cast to float. Returned value is: None",FAIL
167,,2020-10-09 14:01:02.442156,2020-10-09 14:01:42.323437,0 days 00:00:39.881281000,256.0,0.1,0.0002683709153074483,linear_with_warmup,1.0,8.0,192.0,7.051470026755995e-05,"Trial 167 failed, because the returned value from the objective function cannot be cast to float. Returned value is: None",FAIL
168,,2020-10-09 14:01:28.722193,2020-10-09 14:02:03.276576,0 days 00:00:34.554383000,256.0,0.1,0.0002695851147874643,linear_with_warmup,1.0,8.0,192.0,7.46672099763953e-05,"Trial 168 failed, because the returned value from the objective function cannot be cast to float. Returned value is: None",FAIL
169,,2020-10-09 14:01:42.465888,2020-10-09 14:02:20.814617,0 days 00:00:38.348729000,256.0,0.1,0.00026632415713601277,linear_with_warmup,1.0,8.0,192.0,7.245853753624977e-05,"Trial 169 failed, because the returned value from the objective function cannot be cast to float. Returned value is: None",FAIL
170,,2020-10-09 14:02:03.554391,2020-10-09 14:02:42.782568,0 days 00:00:39.228177000,256.0,0.1,0.0002651506577380374,constant_with_warmup,1.0,8.0,192.0,6.900872250417835e-05,"Trial 170 failed, because the returned value from the objective function cannot be cast to float. Returned value is: None",FAIL
171,,2020-10-09 14:02:22.208693,2020-10-09 14:03:00.786002,0 days 00:00:38.577309000,256.0,0.1,0.00027783930020877515,constant_with_warmup,1.0,8.0,192.0,7.244669771706083e-05,"Trial 171 failed, because the returned value from the objective function cannot be cast to float. Returned value is: None",FAIL
172,,2020-10-09 14:02:43.713370,2020-10-09 14:03:23.274124,0 days 00:00:39.560754000,256.0,0.1,0.0002678296917325608,linear_with_warmup,1.0,8.0,192.0,7.314984482256336e-05,"Trial 172 failed, because the returned value from the objective function cannot be cast to float. Returned value is: None",FAIL
173,,2020-10-09 14:03:02.338913,2020-10-09 14:03:40.158118,0 days 00:00:37.819205000,256.0,0.1,0.0002805068412762521,linear_with_warmup,1.0,8.0,192.0,6.603672532878877e-05,"Trial 173 failed, because the returned value from the objective function cannot be cast to float. Returned value is: None",FAIL
