number,value,datetime_start,datetime_complete,duration,params_--d_model,params_--dropout,params_--learning_rate,params_--learning_rate_schedule,params_--n_head,params_--n_layer,params_--num_train_epochs,params_--per_device_train_batch_size,params_--weight_decay,system_attrs_fail_reason,state
240,,2020-10-09 14:05:18.739905,2020-10-09 14:05:55.103405,0 days 00:00:36.363500000,320.0,0.1,0.005099497626566683,linear_with_warmup,1.0,1.0,9.0,64.0,1.3916695315600428e-06,"Trial 240 failed, because the returned value from the objective function cannot be cast to float. Returned value is: None",FAIL
241,,2020-10-09 14:05:24.765358,2020-10-09 14:06:04.150320,0 days 00:00:39.384962000,320.0,0.1,0.005407815624423123,linear_with_warmup,1.0,1.0,9.0,64.0,1.4366410574219976e-06,"Trial 241 failed, because the returned value from the objective function cannot be cast to float. Returned value is: None",FAIL
242,,2020-10-09 14:05:55.692885,2020-10-09 14:06:34.729860,0 days 00:00:39.036975000,320.0,0.1,0.005322374237765037,linear_with_warmup,1.0,1.0,9.0,64.0,1.363396800343317e-06,"Trial 242 failed, because the returned value from the objective function cannot be cast to float. Returned value is: None",FAIL
243,,2020-10-09 14:06:04.312405,2020-10-09 14:06:44.938756,0 days 00:00:40.626351000,320.0,0.1,0.005037906763328151,linear_with_warmup,1.0,1.0,9.0,64.0,1.3782650381459463e-06,"Trial 243 failed, because the returned value from the objective function cannot be cast to float. Returned value is: None",FAIL
244,,2020-10-09 14:06:35.254118,2020-10-09 14:07:14.088034,0 days 00:00:38.833916000,320.0,0.1,0.005383239512080326,linear_with_warmup,1.0,1.0,9.0,64.0,1.3774575414948855e-06,"Trial 244 failed, because the returned value from the objective function cannot be cast to float. Returned value is: None",FAIL
245,,2020-10-09 14:06:45.797762,2020-10-09 14:07:25.071901,0 days 00:00:39.274139000,320.0,0.1,0.005401496449760126,linear_with_warmup,1.0,1.0,9.0,64.0,1.4554679946700812e-06,"Trial 245 failed, because the returned value from the objective function cannot be cast to float. Returned value is: None",FAIL
246,,2020-10-09 14:07:14.668785,2020-10-09 14:07:54.926219,0 days 00:00:40.257434000,320.0,0.1,0.00515873419703763,linear_with_warmup,1.0,3.0,9.0,64.0,1.381348900191343e-06,"Trial 246 failed, because the returned value from the objective function cannot be cast to float. Returned value is: None",FAIL
247,,2020-10-09 14:07:25.809550,2020-10-09 14:08:05.353460,0 days 00:00:39.543910000,320.0,0.1,0.005095663726287016,linear_with_warmup,1.0,1.0,9.0,64.0,1.4037391737905946e-06,"Trial 247 failed, because the returned value from the objective function cannot be cast to float. Returned value is: None",FAIL
248,,2020-10-09 14:07:55.427729,2020-10-09 14:08:35.250717,0 days 00:00:39.822988000,320.0,0.1,0.005451706419055628,linear_with_warmup,1.0,1.0,9.0,64.0,1.429463460253218e-06,"Trial 248 failed, because the returned value from the objective function cannot be cast to float. Returned value is: None",FAIL
249,,2020-10-09 14:08:05.457852,2020-10-09 14:08:45.429119,0 days 00:00:39.971267000,320.0,0.1,0.0050655532783471305,linear_with_warmup,1.0,1.0,9.0,64.0,1.4116919201092707e-06,"Trial 249 failed, because the returned value from the objective function cannot be cast to float. Returned value is: None",FAIL
250,,2020-10-09 14:08:36.646686,2020-10-09 14:09:15.571546,0 days 00:00:38.924860000,320.0,0.1,0.0014299484929984937,linear_with_warmup,1.0,1.0,9.0,64.0,1.4342139002718688e-06,"Trial 250 failed, because the returned value from the objective function cannot be cast to float. Returned value is: None",FAIL
251,,2020-10-09 14:08:45.704884,2020-10-09 14:09:25.460918,0 days 00:00:39.756034000,320.0,0.1,0.005256676305601894,linear_with_warmup,1.0,1.0,9.0,64.0,8.163577588191003e-06,"Trial 251 failed, because the returned value from the objective function cannot be cast to float. Returned value is: None",FAIL
252,,2020-10-09 14:09:15.715792,2020-10-09 14:09:55.354888,0 days 00:00:39.639096000,320.0,0.1,0.005128596969598595,linear_with_warmup,1.0,1.0,9.0,64.0,1.416359431234844e-06,"Trial 252 failed, because the returned value from the objective function cannot be cast to float. Returned value is: None",FAIL
253,,2020-10-09 14:09:25.942118,2020-10-09 14:10:07.282131,0 days 00:00:41.340013000,320.0,0.1,0.00530976011938108,linear_with_warmup,1.0,1.0,9.0,64.0,1.3858191075733493e-06,"Trial 253 failed, because the returned value from the objective function cannot be cast to float. Returned value is: None",FAIL
254,,2020-10-09 14:09:56.002449,2020-10-09 14:10:35.341092,0 days 00:00:39.338643000,320.0,0.1,0.006627198467314788,linear_with_warmup,1.0,1.0,9.0,64.0,1.4143782284424864e-06,"Trial 254 failed, because the returned value from the objective function cannot be cast to float. Returned value is: None",FAIL
255,,2020-10-09 14:10:08.187197,2020-10-09 14:10:44.581867,0 days 00:00:36.394670000,320.0,0.1,0.005017592946537011,linear_with_warmup,1.0,1.0,9.0,64.0,1.4034010652952468e-06,"Trial 255 failed, because the returned value from the objective function cannot be cast to float. Returned value is: None",FAIL
256,,2020-10-09 14:10:36.852143,2020-10-09 14:11:18.109385,0 days 00:00:41.257242000,320.0,0.1,0.005382114255263145,linear_with_warmup,1.0,1.0,9.0,64.0,1.353636026529387e-06,"Trial 256 failed, because the returned value from the objective function cannot be cast to float. Returned value is: None",FAIL
257,,2020-10-09 14:10:45.085463,2020-10-09 14:11:25.089594,0 days 00:00:40.004131000,320.0,0.1,0.007124198072892923,linear_with_warmup,1.0,1.0,9.0,64.0,1.3825144897821695e-06,"Trial 257 failed, because the returned value from the objective function cannot be cast to float. Returned value is: None",FAIL
258,,2020-10-09 14:11:18.773510,2020-10-09 14:11:55.640058,0 days 00:00:36.866548000,320.0,0.1,0.0014575863655709616,linear_with_warmup,1.0,1.0,9.0,64.0,1.454788364554548e-06,"Trial 258 failed, because the returned value from the objective function cannot be cast to float. Returned value is: None",FAIL
259,,2020-10-09 14:11:27.029169,2020-10-09 14:12:05.984131,0 days 00:00:38.954962000,320.0,0.1,0.005003721557530321,linear_with_warmup,1.0,1.0,9.0,64.0,1.3313686958576619e-06,"Trial 259 failed, because the returned value from the objective function cannot be cast to float. Returned value is: None",FAIL
260,,2020-10-09 14:11:56.981775,2020-10-09 14:12:36.825861,0 days 00:00:39.844086000,320.0,0.1,0.004931541145344227,linear_with_warmup,1.0,1.0,9.0,64.0,1.3703477810202956e-06,"Trial 260 failed, because the returned value from the objective function cannot be cast to float. Returned value is: None",FAIL
261,,2020-10-09 14:12:07.704892,2020-10-09 14:12:45.899208,0 days 00:00:38.194316000,320.0,0.1,0.006978042456826286,linear_with_warmup,1.0,1.0,9.0,64.0,8.092721057808793e-06,"Trial 261 failed, because the returned value from the objective function cannot be cast to float. Returned value is: None",FAIL
262,,2020-10-09 14:12:37.520995,2020-10-09 14:13:15.754833,0 days 00:00:38.233838000,320.0,0.1,0.005007306175573954,linear_with_warmup,1.0,1.0,9.0,64.0,1.4309780441570487e-06,"Trial 262 failed, because the returned value from the objective function cannot be cast to float. Returned value is: None",FAIL
263,,2020-10-09 14:12:46.999160,2020-10-09 14:13:25.245534,0 days 00:00:38.246374000,320.0,0.1,0.007059729427289252,linear_with_warmup,1.0,1.0,9.0,64.0,1.5264414453455937e-06,"Trial 263 failed, because the returned value from the objective function cannot be cast to float. Returned value is: None",FAIL
264,,2020-10-09 14:13:17.025692,2020-10-09 14:13:57.062451,0 days 00:00:40.036759000,320.0,0.1,0.007014253477789507,linear_with_warmup,1.0,1.0,9.0,64.0,1.3651527457706076e-06,"Trial 264 failed, because the returned value from the objective function cannot be cast to float. Returned value is: None",FAIL
265,,2020-10-09 14:13:26.921629,2020-10-09 14:14:05.079121,0 days 00:00:38.157492000,320.0,0.1,0.007083230886323723,linear_with_warmup,1.0,1.0,9.0,64.0,1.384766575940253e-06,"Trial 265 failed, because the returned value from the objective function cannot be cast to float. Returned value is: None",FAIL
266,,2020-10-09 14:13:57.278567,2020-10-09 14:14:36.807983,0 days 00:00:39.529416000,320.0,0.1,0.0026835710849143785,linear_with_warmup,1.0,1.0,9.0,64.0,1.5058220635020582e-06,"Trial 266 failed, because the returned value from the objective function cannot be cast to float. Returned value is: None",FAIL
267,,2020-10-09 14:14:05.681042,2020-10-09 14:14:45.648375,0 days 00:00:39.967333000,320.0,0.1,0.005083353206105383,linear_with_warmup,1.0,1.0,9.0,64.0,1.4131426565704729e-06,"Trial 267 failed, because the returned value from the objective function cannot be cast to float. Returned value is: None",FAIL
268,,2020-10-09 14:14:37.592098,2020-10-09 14:15:15.332117,0 days 00:00:37.740019000,320.0,0.1,0.0054395992042419634,linear_with_warmup,1.0,1.0,9.0,64.0,1.365735511363736e-06,"Trial 268 failed, because the returned value from the objective function cannot be cast to float. Returned value is: None",FAIL
269,0.24885591103567448,2020-10-09 14:14:46.920089,2020-10-09 20:36:46.663840,0 days 06:21:59.743751000,320.0,0.1,0.00531055494989142,linear_with_warmup,1.0,1.0,9.0,64.0,1.3304525557660358e-06,,COMPLETE
270,0.21904640275682716,2020-10-09 14:15:15.811932,2020-10-09 20:22:17.579583,0 days 06:07:01.767651000,320.0,0.1,0.00498005781260267,linear_with_warmup,1.0,1.0,9.0,64.0,1.4669980365347437e-06,,COMPLETE
271,0.10777019141167325,2020-10-09 18:30:52.481552,2020-10-09 23:22:48.451173,0 days 04:51:55.969621000,320.0,0.1,0.00687025887678071,cosine_with_warmup,16.0,2.0,6.0,64.0,8.321781343733805e-06,,COMPLETE
272,0.10003991529217973,2020-10-09 18:58:50.116495,2020-10-09 23:31:08.543943,0 days 04:32:18.427448000,320.0,0.1,0.006757296545294385,cosine_with_warmup,16.0,2.0,6.0,64.0,7.771853452545357e-06,,COMPLETE
273,0.2822937532820054,2020-10-09 20:22:19.676037,2020-10-10 00:50:02.288768,0 days 04:27:42.612731000,128.0,0.1,0.007134377330406827,cosine_with_warmup,16.0,3.0,6.0,64.0,8.656236254282778e-06,,COMPLETE
274,0.22348567605095693,2020-10-09 20:26:34.405040,2020-10-09 23:57:12.692369,0 days 03:30:38.287329000,128.0,0.1,0.0068265762861553,cosine_with_warmup,16.0,4.0,6.0,128.0,7.392435265830934e-06,,COMPLETE
275,0.2556688911696298,2020-10-09 20:36:47.211638,2020-10-10 00:27:41.175843,0 days 03:50:53.964205000,256.0,0.1,0.0007826704728226472,cosine_with_warmup,16.0,4.0,6.0,128.0,3.0344497094347468e-06,,COMPLETE
276,0.4755021785193724,2020-10-09 23:22:49.033415,2020-10-10 04:53:51.918380,0 days 05:31:02.884965000,320.0,0.1,0.0025644558110223233,constant_with_warmup,1.0,2.0,7.0,64.0,3.0775692681999856e-06,,COMPLETE
277,0.5274607640375354,2020-10-09 23:31:09.143976,2020-10-10 04:47:48.521153,0 days 05:16:39.377177000,256.0,0.1,0.002723511822917001,constant_with_warmup,1.0,2.0,7.0,64.0,1.1694575265817006e-06,,COMPLETE
278,0.4901910017923005,2020-10-09 23:57:13.539951,2020-10-10 04:47:44.982151,0 days 04:50:31.442200000,256.0,0.1,0.0027875250229478315,constant_with_warmup,1.0,2.0,7.0,64.0,1.1339567558065062e-06,,COMPLETE
279,,2020-10-10 00:27:43.762890,2020-10-10 03:44:58.996494,0 days 03:17:15.233604000,320.0,0.1,0.0026429810627965115,constant_with_warmup,1.0,2.0,7.0,64.0,1.2059690140843183e-06,"Trial 279 failed, because the returned value from the objective function cannot be cast to float. Returned value is: None",FAIL
280,0.41859548149324566,2020-10-10 00:50:05.631877,2020-10-10 06:09:48.697020,0 days 05:19:43.065143000,256.0,0.1,0.0025473786754049974,constant_with_warmup,1.0,2.0,7.0,64.0,1.2211765313693e-06,,COMPLETE
281,0.4588927580335907,2020-10-11 11:09:45.229962,2020-10-11 17:38:34.298224,0 days 06:28:49.068262000,192.0,0.0,0.002458152545730446,constant_with_warmup,1.0,2.0,7.0,64.0,3.021606793937922e-06,,COMPLETE
282,0.2937495936177725,2020-10-11 11:09:45.829706,2020-10-11 16:57:43.827362,0 days 05:47:57.997656000,192.0,0.0,0.0019134690890070989,constant_with_warmup,1.0,2.0,7.0,64.0,1.9886650123853943e-06,,COMPLETE
283,0.43827692689865244,2020-10-11 11:09:46.238100,2020-10-11 17:34:16.310450,0 days 06:24:30.072350000,192.0,0.0,0.0025877408954708097,constant_with_warmup,1.0,2.0,7.0,64.0,1.9598062266878604e-06,,COMPLETE
284,0.31503682181739123,2020-10-11 11:09:46.840529,2020-10-11 17:38:14.285606,0 days 06:28:27.445077000,192.0,0.0,0.0018935711109505512,constant_with_warmup,1.0,2.0,7.0,64.0,1.0052116591961906e-06,,COMPLETE
285,0.24838566480233318,2020-10-11 11:09:47.248717,2020-10-11 17:08:56.178502,0 days 05:59:08.929785000,192.0,0.0,0.001869866747987765,constant_with_warmup,1.0,2.0,7.0,64.0,1.9407529233719577e-06,,COMPLETE
286,0.48344053291572886,2020-10-11 16:57:46.285639,2020-10-11 21:56:33.524540,0 days 04:58:47.238901000,256.0,0.0,0.0027426293335484154,constant_with_warmup,1.0,2.0,7.0,64.0,3.0896627527040112e-06,,COMPLETE
287,0.5078611480354965,2020-10-11 17:08:57.961255,2020-10-11 21:57:45.031712,0 days 04:48:47.070457000,256.0,0.1,0.002602518148285725,constant_with_warmup,2.0,2.0,7.0,64.0,3.3212882809615164e-06,,COMPLETE
288,0.530398186677892,2020-10-11 17:34:17.721723,2020-10-11 23:09:11.613726,0 days 05:34:53.892003000,256.0,0.1,0.002765352013424135,constant_with_warmup,2.0,2.0,8.0,64.0,3.1625564350525762e-06,,COMPLETE
289,0.5168561382321677,2020-10-11 17:38:16.845933,2020-10-11 21:41:35.165662,0 days 04:03:18.319729000,256.0,0.1,0.002719160231989903,constant_with_warmup,2.0,2.0,8.0,128.0,3.083782814557622e-06,,COMPLETE
290,0.44562969263047414,2020-10-11 17:38:35.926218,2020-10-11 22:08:03.363996,0 days 04:29:27.437778000,256.0,0.1,0.004437125097917595,constant_with_warmup,2.0,2.0,8.0,128.0,1.3865936698990884e-05,,COMPLETE
291,0.45392109286563914,2020-10-11 21:41:36.151660,2020-10-12 03:15:38.557853,0 days 05:34:02.406193000,256.0,0.1,0.004200098829900725,constant_with_warmup,2.0,2.0,8.0,64.0,3.9295282424970855e-06,,COMPLETE
292,0.4795039711138053,2020-10-11 21:56:35.913154,2020-10-12 02:06:29.211104,0 days 04:09:53.297950000,256.0,0.1,0.004400970538707362,constant_with_warmup,2.0,2.0,8.0,128.0,3.833618284826713e-06,,COMPLETE
293,0.42026255921644307,2020-10-11 21:57:46.368185,2020-10-12 01:59:59.778528,0 days 04:02:13.410343000,256.0,0.1,0.004357199255434283,constant_with_warmup,2.0,2.0,8.0,128.0,2.390545264904807e-06,,COMPLETE
294,0.23550540534776276,2020-10-11 22:08:03.996026,2020-10-12 04:15:58.156129,0 days 06:07:54.160103000,256.0,0.1,0.0012992024363044402,constant_with_warmup,2.0,2.0,8.0,64.0,3.7571616486648624e-06,,COMPLETE
295,0.24772824785732864,2020-10-11 23:09:12.776395,2020-10-12 03:22:17.095625,0 days 04:13:04.319230000,256.0,0.1,0.0011897388992970176,constant_with_warmup,2.0,2.0,8.0,128.0,3.5182035569340925e-06,,COMPLETE
296,0.24550239702037566,2020-10-12 02:00:00.675882,2020-10-12 07:29:08.508117,0 days 05:29:07.832235000,256.0,0.1,0.000899052372312346,constant_with_warmup,2.0,2.0,8.0,64.0,3.7596118605061714e-06,,COMPLETE
297,0.4658034157887437,2020-10-12 02:06:30.265393,2020-10-12 07:35:38.876840,0 days 05:29:08.611447000,256.0,0.1,0.003149455564825141,constant_with_warmup,2.0,2.0,8.0,64.0,3.763467245657974e-06,,COMPLETE
298,0.4890847841285934,2020-10-12 03:15:40.500282,2020-10-12 08:44:29.748504,0 days 05:28:49.248222000,256.0,0.1,0.0030357914667392717,constant_with_warmup,2.0,2.0,8.0,64.0,2.693913642165793e-06,,COMPLETE
299,0.5226499655172323,2020-10-12 03:22:18.189849,2020-10-12 08:49:07.914351,0 days 05:26:49.724502000,256.0,0.1,0.0031073696250359206,constant_with_warmup,2.0,2.0,8.0,64.0,5.85995184336787e-06,,COMPLETE
300,0.49608783748229135,2020-10-12 04:15:59.387704,2020-10-12 10:30:47.571041,0 days 06:14:48.183337000,256.0,0.1,0.0029379741878133867,constant_with_warmup,2.0,2.0,8.0,64.0,5.133497144829086e-06,,COMPLETE
301,0.45165067657748975,2020-10-12 07:29:09.421037,2020-10-12 11:45:16.463550,0 days 04:16:07.042513000,256.0,0.1,0.002261841416472991,constant_with_warmup,2.0,2.0,6.0,64.0,5.840168710891013e-06,,COMPLETE
302,0.41476240276567605,2020-10-12 07:35:39.563384,2020-10-12 11:56:08.924382,0 days 04:20:29.360998000,256.0,0.1,0.0021649675568823565,constant_with_warmup,2.0,2.0,6.0,64.0,5.669916837272312e-06,,COMPLETE
303,0.5513989834435264,2020-10-12 08:44:31.520409,2020-10-12 14:49:10.872466,0 days 06:04:39.352057000,256.0,0.1,0.002162094632215143,constant_with_warmup,2.0,2.0,9.0,64.0,5.189724812073076e-06,,COMPLETE
304,0.5102099326754838,2020-10-12 08:49:10.383513,2020-10-12 14:49:48.207139,0 days 06:00:37.823626000,256.0,0.1,0.0021985001770783584,constant_with_warmup,2.0,2.0,9.0,64.0,6.4142012832056325e-06,,COMPLETE
305,0.5158801311679093,2020-10-12 10:30:49.632695,2020-10-12 17:18:15.912833,0 days 06:47:26.280138000,256.0,0.1,0.002311364255413279,constant_with_warmup,2.0,2.0,9.0,64.0,4.6152791944659446e-06,,COMPLETE
306,0.4746018199611252,2020-10-12 11:45:18.218466,2020-10-12 15:42:17.420098,0 days 03:56:59.201632000,256.0,0.1,0.003815166574924076,constant_with_warmup,2.0,2.0,9.0,256.0,4.794685071564397e-06,,COMPLETE
307,,2020-10-12 11:56:09.600133,,,256.0,0.1,0.00380788841197962,constant_with_warmup,2.0,2.0,9.0,64.0,4.546901095718194e-06,,RUNNING
308,,2020-10-12 14:49:12.062361,,,256.0,0.1,0.0037325535074417596,constant_with_warmup,2.0,2.0,9.0,64.0,6.5719923574731366e-06,,RUNNING
309,,2020-10-12 14:49:48.980406,,,256.0,0.1,0.0036008125756471286,constant_with_warmup,2.0,2.0,9.0,64.0,4.784697624428591e-06,,RUNNING
310,,2020-10-12 15:42:18.284543,,,256.0,0.1,0.0017173670265229902,constant_with_warmup,2.0,2.0,10.0,64.0,6.899772378800067e-06,,RUNNING
311,,2020-10-12 17:18:16.625075,,,256.0,0.1,0.0016179759857516541,constant_with_warmup,2.0,2.0,10.0,64.0,6.497400320629948e-06,,RUNNING
