number,value,datetime_start,datetime_complete,duration,params_--d_model,params_--dropout,params_--learning_rate,params_--learning_rate_schedule,params_--n_head,params_--n_layer,params_--num_train_epochs,params_--per_device_train_batch_size,params_--weight_decay,system_attrs_fail_reason,state
154,,2020-10-07 10:08:06.039983,2020-10-07 10:08:53.989458,0 days 00:00:47.949475000,320.0,0.1,0.0002313887434148026,linear_with_warmup,8.0,3.0,8.0,128.0,2.324092792871282e-06,"Trial 154 failed, because the returned value from the objective function cannot be cast to float. Returned value is: None",FAIL
155,,2020-10-07 10:08:54.227318,,,,,,,,,,,,,RUNNING
156,,2020-10-07 11:07:17.513318,2020-10-07 11:07:55.948279,0 days 00:00:38.434961000,256.0,0.1,0.0002374304146729653,linear_with_warmup,8.0,3.0,8.0,128.0,2.221282701029224e-06,"Trial 156 failed, because the returned value from the objective function cannot be cast to float. Returned value is: None",FAIL
157,,2020-10-07 11:07:56.955335,,,,,,,,,,,,,RUNNING
158,,2020-10-07 16:43:50.268252,2020-10-07 16:44:00.138612,0 days 00:00:09.870360000,320.0,0.1,0.003708392901688032,linear_with_warmup,1.0,3.0,8.0,128.0,2.6763179160489325e-06,"Trial 158 failed because of the following error: KeyError(<autobench.core.job.Job object at 0x7f691d4a2630>,)",FAIL
159,,2020-10-07 16:43:51.993437,,,,,,,,,,,,,RUNNING
160,,2020-10-07 16:43:52.184822,2020-10-07 16:44:00.321990,0 days 00:00:08.137168000,320.0,0.1,0.0002321939421851043,linear_with_warmup,8.0,3.0,8.0,128.0,2.2347941087496885e-06,"Trial 160 failed because of the following error: KeyError(<autobench.core.job.Job object at 0x7f691d43c978>,)",FAIL
161,,2020-10-07 16:43:52.346626,2020-10-07 16:43:55.330367,0 days 00:00:02.983741000,320.0,0.1,0.0002589371569895645,linear_with_warmup,1.0,3.0,8.0,128.0,2.3576882803998683e-06,"Trial 161 failed because of the following error: KeyError(<autobench.core.job.Job object at 0x7f691d491eb8>,)",FAIL
162,,2020-10-07 16:43:52.522710,,,,,,,,,,,,,RUNNING
163,,2020-10-07 16:43:55.500736,,,,,,,,,,,,,RUNNING
164,,2020-10-07 16:44:45.997161,2020-10-07 22:48:57.771418,0 days 06:04:11.774257000,320.0,0.1,0.00026474269733227113,linear_with_warmup,1.0,3.0,8.0,128.0,2.1920744116555126e-06,"Trial 164 failed, because the returned value from the objective function cannot be cast to float. Returned value is: None",FAIL
165,,2020-10-07 16:44:46.846993,2020-10-07 22:53:59.641050,0 days 06:09:12.794057000,320.0,0.1,0.0002567788988311283,linear_with_warmup,1.0,3.0,8.0,128.0,2.38872255516755e-06,"Trial 165 failed, because the returned value from the objective function cannot be cast to float. Returned value is: None",FAIL
166,,2020-10-07 16:44:46.976066,2020-10-07 20:02:55.293581,0 days 03:18:08.317515000,320.0,0.1,0.0033654448354247853,linear_with_warmup,1.0,3.0,8.0,128.0,1.935551754523073e-06,"Trial 166 failed, because the returned value from the objective function cannot be cast to float. Returned value is: None",FAIL
167,,2020-10-07 16:44:47.844550,2020-10-07 21:28:08.445454,0 days 04:43:20.600904000,320.0,0.1,0.0002688359701126381,linear_with_warmup,1.0,3.0,8.0,128.0,2.7483474985523516e-06,"Trial 167 failed, because the returned value from the objective function cannot be cast to float. Returned value is: None",FAIL
168,0.44233340224104933,2020-10-07 16:44:47.940636,2020-10-07 23:56:21.134701,0 days 07:11:33.194065000,320.0,0.1,0.003249363609510841,linear_with_warmup,1.0,3.0,8.0,128.0,2.432085171517407e-06,,COMPLETE
169,,2020-10-07 20:02:55.588942,2020-10-07 21:27:03.975226,0 days 01:24:08.386284000,320.0,0.1,0.0002465783234186534,linear_with_warmup,1.0,3.0,8.0,128.0,2.3080816068007955e-06,"Trial 169 failed, because the returned value from the objective function cannot be cast to float. Returned value is: None",FAIL
170,,2020-10-07 21:27:04.222554,2020-10-07 22:49:18.054393,0 days 01:22:13.831839000,320.0,0.1,0.00024298602228731535,linear_with_warmup,1.0,3.0,8.0,128.0,2.6301544631740453e-06,"Trial 170 failed, because the returned value from the objective function cannot be cast to float. Returned value is: None",FAIL
171,,2020-10-07 21:28:08.576910,2020-10-07 22:49:25.780366,0 days 01:21:17.203456000,320.0,0.1,0.00022293756747706063,linear_with_warmup,1.0,3.0,8.0,128.0,2.427462010428796e-06,"Trial 171 failed, because the returned value from the objective function cannot be cast to float. Returned value is: None",FAIL
172,,2020-10-07 22:48:58.737992,2020-10-07 22:49:35.221686,0 days 00:00:36.483694000,320.0,0.1,0.0002609509080877535,linear_with_warmup,8.0,3.0,8.0,128.0,2.4596416310872627e-06,"Trial 172 failed, because the returned value from the objective function cannot be cast to float. Returned value is: None",FAIL
173,,2020-10-07 22:49:18.282275,2020-10-07 22:49:59.665531,0 days 00:00:41.383256000,320.0,0.1,0.0036281734945634325,linear_with_warmup,1.0,3.0,8.0,128.0,2.276167041326813e-06,"Trial 173 failed, because the returned value from the objective function cannot be cast to float. Returned value is: None",FAIL
174,,2020-10-07 22:49:25.967205,2020-10-07 22:49:58.302234,0 days 00:00:32.335029000,320.0,0.1,0.00025212949953507793,linear_with_warmup,1.0,3.0,8.0,128.0,2.4311894600987962e-06,"Trial 174 failed, because the returned value from the objective function cannot be cast to float. Returned value is: None",FAIL
175,,2020-10-07 22:49:35.435621,2020-10-07 22:50:13.826746,0 days 00:00:38.391125000,320.0,0.1,0.0002458697890397954,linear_with_warmup,1.0,3.0,8.0,128.0,2.4415269594988388e-06,"Trial 175 failed, because the returned value from the objective function cannot be cast to float. Returned value is: None",FAIL
176,,2020-10-07 22:49:58.588399,2020-10-07 22:54:02.481137,0 days 00:04:03.892738000,320.0,0.1,0.003812577318476795,linear_with_warmup,1.0,3.0,8.0,128.0,2.6067647412685942e-06,"Trial 176 failed, because the returned value from the objective function cannot be cast to float. Returned value is: None",FAIL
177,,2020-10-07 22:49:59.977701,2020-10-07 22:54:14.456433,0 days 00:04:14.478732000,320.0,0.1,0.000263314497392711,linear_with_warmup,1.0,3.0,8.0,128.0,2.4123860665424044e-06,"Trial 177 failed, because the returned value from the objective function cannot be cast to float. Returned value is: None",FAIL
178,,2020-10-07 22:50:14.345531,2020-10-07 22:54:14.228721,0 days 00:03:59.883190000,320.0,0.1,0.0035306715114572585,linear_with_warmup,1.0,3.0,8.0,128.0,1.9913786027869506e-06,"Trial 178 failed, because the returned value from the objective function cannot be cast to float. Returned value is: None",FAIL
179,,2020-10-07 22:54:00.172987,2020-10-07 22:54:38.689427,0 days 00:00:38.516440000,320.0,0.1,0.0002561819689116119,linear_with_warmup,1.0,3.0,8.0,128.0,2.4244777953913236e-06,"Trial 179 failed, because the returned value from the objective function cannot be cast to float. Returned value is: None",FAIL
180,,2020-10-07 22:54:02.881215,2020-10-08 02:41:35.785589,0 days 03:47:32.904374000,320.0,0.1,0.00024276773699990098,linear_with_warmup,1.0,3.0,8.0,128.0,2.6753506834497056e-06,"Trial 180 failed, because the returned value from the objective function cannot be cast to float. Returned value is: None",FAIL
181,0.27374783320985047,2020-10-07 22:54:14.586109,2020-10-08 05:08:57.671630,0 days 06:14:43.085521000,320.0,0.1,0.0002484349353682813,linear_with_warmup,1.0,3.0,8.0,128.0,2.4605917721301377e-06,,COMPLETE
182,,2020-10-07 22:54:14.718204,2020-10-08 04:09:28.076667,0 days 05:15:13.358463000,320.0,0.1,0.00023092933298535733,linear_with_warmup,1.0,3.0,8.0,128.0,2.588352910368368e-06,"Trial 182 failed, because the returned value from the objective function cannot be cast to float. Returned value is: None",FAIL
183,0.2740375114064982,2020-10-07 22:54:38.926148,2020-10-08 05:18:59.586270,0 days 06:24:20.660122000,320.0,0.1,0.0002591642496962418,linear_with_warmup,1.0,3.0,8.0,128.0,2.352160399386405e-06,,COMPLETE
184,,2020-10-07 23:56:21.828420,2020-10-08 00:35:45.272653,0 days 00:39:23.444233000,320.0,0.1,0.0037491942926431558,linear_with_warmup,1.0,3.0,8.0,64.0,1.7024298666514104e-06,"Trial 184 failed, because the returned value from the objective function cannot be cast to float. Returned value is: None",FAIL
185,,2020-10-08 00:35:45.853085,2020-10-08 00:36:19.178515,0 days 00:00:33.325430000,320.0,0.1,0.0035149652412436163,linear_with_warmup,1.0,3.0,8.0,64.0,1.7106394335077092e-06,"Trial 185 failed, because the returned value from the objective function cannot be cast to float. Returned value is: None",FAIL
186,,2020-10-08 00:36:19.779203,2020-10-08 00:37:05.242692,0 days 00:00:45.463489000,320.0,0.1,0.0029799369784605143,linear_with_warmup,1.0,3.0,8.0,64.0,1.9647051167986e-06,"Trial 186 failed, because the returned value from the objective function cannot be cast to float. Returned value is: None",FAIL
187,,2020-10-08 00:37:05.423453,2020-10-08 00:42:30.585587,0 days 00:05:25.162134000,320.0,0.1,0.003423979486255272,linear_with_warmup,1.0,3.0,8.0,64.0,1.6615460829568834e-06,"Trial 187 failed, because the returned value from the objective function cannot be cast to float. Returned value is: None",FAIL
188,,2020-10-08 00:42:31.021988,2020-10-08 00:43:12.298075,0 days 00:00:41.276087000,320.0,0.1,0.003938008321470895,linear_with_warmup,1.0,3.0,8.0,64.0,1.9481126010648894e-06,"Trial 188 failed, because the returned value from the objective function cannot be cast to float. Returned value is: None",FAIL
189,,2020-10-08 00:43:13.527255,2020-10-08 00:43:50.363075,0 days 00:00:36.835820000,320.0,0.1,0.0034554758457071904,linear_with_warmup,1.0,3.0,8.0,64.0,2.131180471812947e-06,"Trial 189 failed, because the returned value from the objective function cannot be cast to float. Returned value is: None",FAIL
190,,2020-10-08 00:43:51.750499,2020-10-08 00:44:39.783643,0 days 00:00:48.033144000,320.0,0.1,0.003676114904321683,linear_with_warmup,1.0,3.0,8.0,64.0,2.011249137330266e-06,"Trial 190 failed, because the returned value from the objective function cannot be cast to float. Returned value is: None",FAIL
191,,2020-10-08 00:44:40.393972,2020-10-08 03:56:27.928373,0 days 03:11:47.534401000,320.0,0.1,0.0037331103489297913,linear_with_warmup,1.0,3.0,8.0,64.0,1.0012250422272734e-06,"Trial 191 failed, because the returned value from the objective function cannot be cast to float. Returned value is: None",FAIL
192,,2020-10-08 02:41:36.390621,2020-10-08 02:42:14.138542,0 days 00:00:37.747921000,320.0,0.1,0.002909776955595509,linear_with_warmup,1.0,3.0,8.0,64.0,1.1283711564810517e-06,"Trial 192 failed, because the returned value from the objective function cannot be cast to float. Returned value is: None",FAIL
193,0.4554987798952826,2020-10-08 02:42:15.968842,2020-10-08 08:52:41.043523,0 days 06:10:25.074681000,320.0,0.1,0.003505033612785489,linear_with_warmup,1.0,3.0,8.0,64.0,1.7109158523693374e-06,,COMPLETE
194,0.3262606514167434,2020-10-08 03:56:28.095203,2020-10-08 10:18:50.626487,0 days 06:22:22.531284000,320.0,0.1,0.00398164999527011,linear_with_warmup,1.0,3.0,8.0,64.0,1.9787037261302465e-06,,COMPLETE
195,0.48844445185389523,2020-10-08 04:09:28.428096,2020-10-08 10:52:26.411405,0 days 06:42:57.983309000,320.0,0.1,0.003313171581140255,linear_with_warmup,1.0,3.0,8.0,64.0,2.160504050648896e-06,,COMPLETE
196,0.4319098359560816,2020-10-08 05:08:58.211795,2020-10-08 12:03:01.475912,0 days 06:54:03.264117000,320.0,0.1,0.004140519113862834,linear_with_warmup,1.0,3.0,7.0,64.0,1.7528508482096385e-06,,COMPLETE
197,0.29590706037828785,2020-10-08 05:19:00.538708,2020-10-08 12:31:11.981997,0 days 07:12:11.443289000,320.0,0.1,0.0033169393285452675,linear_with_warmup,1.0,2.0,8.0,64.0,1.1015513010949583e-06,,COMPLETE
198,0.44631641506675035,2020-10-08 08:52:41.924112,2020-10-08 15:34:54.106266,0 days 06:42:12.182154000,320.0,0.1,0.0037337391081567694,linear_with_warmup,1.0,2.0,7.0,64.0,1.1176113641287427e-06,,COMPLETE
199,0.3865804269956619,2020-10-08 10:18:51.883291,2020-10-08 17:39:15.813907,0 days 07:20:23.930616000,320.0,0.1,0.003463381984823031,linear_with_warmup,1.0,3.0,7.0,64.0,1.0200158437593612e-06,,COMPLETE
200,0.4951190352677289,2020-10-08 10:52:27.265168,2020-10-08 17:16:40.257076,0 days 06:24:12.991908000,320.0,0.1,0.003309968236801944,linear_with_warmup,1.0,2.0,7.0,64.0,1.103891295161554e-06,,COMPLETE
201,0.48569534987550733,2020-10-08 12:03:02.369581,2020-10-08 17:35:00.589971,0 days 05:31:58.220390000,320.0,0.1,0.003063736060954301,linear_with_warmup,1.0,2.0,7.0,64.0,1.0132467715348221e-06,,COMPLETE
202,0.40230047143044156,2020-10-08 12:31:13.123716,2020-10-08 17:46:46.848525,0 days 05:15:33.724809000,320.0,0.1,0.00296072043427684,linear_with_warmup,1.0,2.0,7.0,64.0,1.054250624236261e-06,,COMPLETE
203,0.1287578838550201,2020-10-08 15:34:55.701887,2020-10-08 19:33:38.280610,0 days 03:58:42.578723000,320.0,0.1,0.009746288660234177,linear_with_warmup,1.0,2.0,5.0,64.0,9.116050414354604e-05,,COMPLETE
204,0.13924413870730318,2020-10-08 17:16:41.320080,2020-10-08 21:08:02.313023,0 days 03:51:20.992943000,320.0,0.2,0.009071979267031575,linear_with_warmup,1.0,2.0,5.0,64.0,9.824450305199942e-05,,COMPLETE
205,0.14014325877211442,2020-10-08 17:35:02.005035,2020-10-08 21:35:28.371135,0 days 04:00:26.366100000,320.0,0.2,0.009559474539955431,linear_with_warmup,1.0,2.0,5.0,64.0,1.715888914680673e-05,,COMPLETE
206,0.25754420770162134,2020-10-08 17:39:16.425338,2020-10-08 21:27:45.837630,0 days 03:48:29.412292000,256.0,0.2,0.0015635640705152745,linear_with_warmup,2.0,2.0,5.0,64.0,1.9162311938684095e-05,,COMPLETE
207,0.15453654487898993,2020-10-08 17:46:47.783687,2020-10-08 21:27:45.429314,0 days 03:40:57.645627000,256.0,0.2,0.00972116985847194,linear_with_warmup,2.0,2.0,5.0,64.0,5.8086706241384804e-05,,COMPLETE
208,0.3510842630113783,2020-10-08 19:33:40.874085,2020-10-08 23:36:23.252459,0 days 04:02:42.378374000,256.0,0.2,0.0054519654136306675,cosine_with_warmup,2.0,2.0,5.0,64.0,2.021307380383866e-05,,COMPLETE
209,,2020-10-08 21:08:02.845853,2020-10-08 23:44:41.715255,0 days 02:36:38.869402000,320.0,0.1,0.005605984361798361,linear_with_warmup,2.0,2.0,6.0,64.0,1.4423249285688374e-06,"Trial 209 failed, because the returned value from the objective function cannot be cast to float. Returned value is: None",FAIL
210,,2020-10-08 21:27:46.210255,2020-10-08 23:50:51.964335,0 days 02:23:05.754080000,320.0,0.1,0.005101514444829178,cosine_with_warmup,1.0,2.0,6.0,64.0,1.5478910915726479e-06,"Trial 210 failed, because the returned value from the objective function cannot be cast to float. Returned value is: None",FAIL
211,,2020-10-08 21:27:47.456655,2020-10-08 23:52:03.616605,0 days 02:24:16.159950000,320.0,0.1,0.005662881583790356,cosine_with_warmup,1.0,2.0,6.0,64.0,1.3653108849679068e-06,"Trial 211 failed, because the returned value from the objective function cannot be cast to float. Returned value is: None",FAIL
212,,2020-10-08 21:35:28.869027,2020-10-08 23:53:14.970220,0 days 02:17:46.101193000,320.0,0.1,0.0055344191560047105,cosine_with_warmup,1.0,1.0,6.0,64.0,1.5118864732253832e-06,"Trial 212 failed, because the returned value from the objective function cannot be cast to float. Returned value is: None",FAIL
213,,2020-10-08 23:36:24.984920,2020-10-08 23:54:32.635689,0 days 00:18:07.650769000,320.0,0.1,0.004982436267969133,linear_with_warmup,1.0,1.0,9.0,64.0,1.4418876119235892e-06,"Trial 213 failed, because the returned value from the objective function cannot be cast to float. Returned value is: None",FAIL
214,,2020-10-08 23:44:42.065512,2020-10-08 23:56:05.889097,0 days 00:11:23.823585000,320.0,0.1,0.0052606480272105105,linear_with_warmup,1.0,1.0,9.0,64.0,1.4642929175061252e-06,"Trial 214 failed, because the returned value from the objective function cannot be cast to float. Returned value is: None",FAIL
215,,2020-10-08 23:50:52.171170,2020-10-08 23:58:32.903588,0 days 00:07:40.732418000,320.0,0.1,0.0014918110049671935,linear_with_warmup,1.0,1.0,9.0,64.0,1.3511717222877458e-06,"Trial 215 failed, because the returned value from the objective function cannot be cast to float. Returned value is: None",FAIL
216,,2020-10-08 23:52:04.681242,2020-10-08 23:52:27.317124,0 days 00:00:22.635882000,320.0,0.1,0.001463143597296467,linear_with_warmup,1.0,1.0,9.0,64.0,1.430555722526745e-06,"Trial 216 failed because of the following error: KeyError(<autobench.core.job.Job object at 0x7fae8c6af6d8>,)",FAIL
217,,2020-10-08 23:52:27.951993,,,,,,,,,,,,,RUNNING
218,,2020-10-08 23:53:15.170635,,,,,,,,,,,,,RUNNING
219,,2020-10-08 23:54:33.384106,,,,,,,,,,,,,RUNNING
220,,2020-10-08 23:56:06.449788,,,,,,,,,,,,,RUNNING
221,0.3717769483840677,2020-10-09 12:03:25.155067,2020-10-09 20:26:33.973600,0 days 08:23:08.818533000,320.0,0.1,0.0015627298638340506,linear_with_warmup,1.0,3.0,9.0,64.0,1.517920044469246e-06,,COMPLETE
222,,2020-10-09 12:03:26.028110,2020-10-09 14:00:24.730726,0 days 01:56:58.702616000,320.0,0.1,0.007072525024574861,linear_with_warmup,1.0,1.0,9.0,64.0,1.3996499152107293e-06,"Trial 222 failed, because the returned value from the objective function cannot be cast to float. Returned value is: None",FAIL
223,0.2503041295096538,2020-10-09 12:03:26.433263,2020-10-09 18:30:50.027943,0 days 06:27:23.594680000,320.0,0.1,0.0014667342638419315,linear_with_warmup,1.0,1.0,9.0,64.0,1.4288168743219483e-06,,COMPLETE
224,,2020-10-09 12:03:26.675259,2020-10-09 14:00:26.996158,0 days 01:57:00.320899000,320.0,0.1,0.00514624137365623,linear_with_warmup,1.0,3.0,9.0,64.0,1.3386610511564955e-06,"Trial 224 failed, because the returned value from the objective function cannot be cast to float. Returned value is: None",FAIL
225,0.2077255531902482,2020-10-09 12:03:26.672399,2020-10-09 18:58:49.303829,0 days 06:55:22.631430000,320.0,0.1,0.005159449282232713,linear_with_warmup,1.0,1.0,9.0,64.0,1.4416581371967293e-06,,COMPLETE
226,,2020-10-09 14:00:27.453080,2020-10-09 14:01:14.672458,0 days 00:00:47.219378000,320.0,0.1,0.005199755213671293,linear_with_warmup,1.0,3.0,9.0,64.0,1.4421090927906397e-06,"Trial 226 failed, because the returned value from the objective function cannot be cast to float. Returned value is: None",FAIL
227,,2020-10-09 14:00:28.547674,2020-10-09 14:01:17.939665,0 days 00:00:49.391991000,320.0,0.1,0.0026372680889607293,linear_with_warmup,1.0,1.0,9.0,64.0,1.4593225847258758e-06,"Trial 227 failed, because the returned value from the objective function cannot be cast to float. Returned value is: None",FAIL
228,,2020-10-09 14:01:15.469715,2020-10-09 14:01:54.273772,0 days 00:00:38.804057000,320.0,0.1,0.0052223002952331635,linear_with_warmup,1.0,1.0,9.0,64.0,1.4827710339055334e-06,"Trial 228 failed, because the returned value from the objective function cannot be cast to float. Returned value is: None",FAIL
229,,2020-10-09 14:01:18.373885,2020-10-09 14:02:05.099191,0 days 00:00:46.725306000,320.0,0.1,0.006986218341187004,linear_with_warmup,1.0,1.0,9.0,64.0,1.3962917235928985e-06,"Trial 229 failed, because the returned value from the objective function cannot be cast to float. Returned value is: None",FAIL
230,,2020-10-09 14:01:55.232625,2020-10-09 14:02:36.984745,0 days 00:00:41.752120000,320.0,0.1,0.007065762870936786,linear_with_warmup,1.0,1.0,9.0,64.0,8.520609852520414e-06,"Trial 230 failed, because the returned value from the objective function cannot be cast to float. Returned value is: None",FAIL
231,,2020-10-09 14:02:05.342431,2020-10-09 14:02:45.159836,0 days 00:00:39.817405000,320.0,0.1,0.005126837269353507,linear_with_warmup,1.0,1.0,9.0,64.0,8.723595285660845e-06,"Trial 231 failed, because the returned value from the objective function cannot be cast to float. Returned value is: None",FAIL
232,,2020-10-09 14:02:37.288525,2020-10-09 14:03:14.087950,0 days 00:00:36.799425000,320.0,0.1,0.005010547825953869,linear_with_warmup,1.0,1.0,9.0,64.0,1.3912966127791165e-06,"Trial 232 failed, because the returned value from the objective function cannot be cast to float. Returned value is: None",FAIL
233,,2020-10-09 14:02:47.259685,2020-10-09 14:03:24.501829,0 days 00:00:37.242144000,320.0,0.1,0.007032519753391319,linear_with_warmup,1.0,1.0,9.0,64.0,1.3987455475990183e-06,"Trial 233 failed, because the returned value from the objective function cannot be cast to float. Returned value is: None",FAIL
234,,2020-10-09 14:03:14.843606,2020-10-09 14:03:53.926789,0 days 00:00:39.083183000,320.0,0.1,0.005182844822907912,linear_with_warmup,1.0,3.0,9.0,64.0,1.350570272361296e-06,"Trial 234 failed, because the returned value from the objective function cannot be cast to float. Returned value is: None",FAIL
235,,2020-10-09 14:03:24.703355,2020-10-09 14:04:05.045691,0 days 00:00:40.342336000,320.0,0.1,0.005272513232441984,linear_with_warmup,1.0,1.0,9.0,64.0,1.454827463084466e-06,"Trial 235 failed, because the returned value from the objective function cannot be cast to float. Returned value is: None",FAIL
236,,2020-10-09 14:03:54.528236,2020-10-09 14:04:34.356991,0 days 00:00:39.828755000,320.0,0.1,0.005189199678881812,linear_with_warmup,1.0,1.0,9.0,64.0,1.4786500040529546e-06,"Trial 236 failed, because the returned value from the objective function cannot be cast to float. Returned value is: None",FAIL
237,,2020-10-09 14:04:05.443253,2020-10-09 14:04:44.779589,0 days 00:00:39.336336000,320.0,0.1,0.005539623064234385,linear_with_warmup,1.0,1.0,9.0,64.0,1.458165768936097e-06,"Trial 237 failed, because the returned value from the objective function cannot be cast to float. Returned value is: None",FAIL
238,,2020-10-09 14:04:35.632947,2020-10-09 14:05:18.355968,0 days 00:00:42.723021000,320.0,0.1,0.005175322653910857,linear_with_warmup,1.0,1.0,9.0,64.0,1.398140639763415e-06,"Trial 238 failed, because the returned value from the objective function cannot be cast to float. Returned value is: None",FAIL
239,,2020-10-09 14:04:45.022730,2020-10-09 14:05:24.587746,0 days 00:00:39.565016000,320.0,0.1,0.0051477431355761,linear_with_warmup,1.0,1.0,9.0,64.0,1.4425143403348038e-06,"Trial 239 failed, because the returned value from the objective function cannot be cast to float. Returned value is: None",FAIL
