number,value,datetime_start,datetime_complete,duration,params_--d_model,params_--dropout,params_--learning_rate,params_--learning_rate_schedule,params_--n_layer,params_--num_train_epochs,params_--per_device_train_batch_size,params_--weight_decay,system_attrs_fail_reason,state
0,0.07229628842406709,2020-09-23 10:15:02.387909,2020-09-23 18:53:10.365708,0 days 08:38:07.977799000,32.0,0.3,0.000116200136389004,cosine_with_warmup,4.0,5.0,192.0,3.435579560934281e-06,,COMPLETE
1,0.1591888277091456,2020-09-23 10:15:02.399549,2020-09-23 15:48:55.636149,0 days 05:33:53.236600000,128.0,0.2,0.0007897472357783797,cosine_with_warmup,2.0,2.0,192.0,1.462836141216612e-05,,COMPLETE
2,0.22790960626310378,2020-09-23 10:15:02.419344,2020-09-23 16:36:04.392464,0 days 06:21:01.973120000,256.0,0.1,0.0006975615507864727,constant_with_warmup,2.0,4.0,256.0,2.0874700555899675e-05,,COMPLETE
3,0.16868006947701125,2020-09-23 10:15:02.438411,2020-09-23 16:39:46.359948,0 days 06:24:43.921537000,256.0,0.3,0.00033128003570479094,linear_with_warmup,2.0,2.0,128.0,1.329690483743149e-06,,COMPLETE
4,0.09283920649381071,2020-09-23 10:15:02.453914,2020-09-23 15:25:21.417972,0 days 05:10:18.964058000,128.0,0.2,0.00017373416494538202,linear_with_warmup,4.0,1.0,64.0,5.8834294371271966e-05,,COMPLETE
5,0.17991029413463547,2020-09-23 15:25:21.514873,2020-09-23 23:05:34.929787,0 days 07:40:13.414914000,32.0,0.0,0.004962294785874929,linear_with_warmup,3.0,3.0,192.0,6.189452157062219e-06,,COMPLETE
6,0.09765647690364641,2020-09-23 15:48:55.688896,2020-09-23 23:43:07.167535,0 days 07:54:11.478639000,128.0,0.1,0.004134740680274474,cosine_with_warmup,4.0,2.0,256.0,2.2322103170836363e-05,,COMPLETE
7,0.10230377761690722,2020-09-23 16:36:04.464870,2020-09-24 01:09:25.898049,0 days 08:33:21.433179000,128.0,0.2,0.003564606289285442,linear_with_warmup,4.0,3.0,128.0,2.250043234130944e-06,,COMPLETE
8,0.14323567240136767,2020-09-23 16:39:46.420108,2020-09-24 01:34:30.311314,0 days 08:54:43.891206000,256.0,0.3,0.0001587700935064471,cosine_with_warmup,2.0,4.0,192.0,2.3828718042445125e-06,,COMPLETE
9,0.07383765129620516,2020-09-23 18:53:10.463317,2020-09-24 00:14:59.442579,0 days 05:21:48.979262000,32.0,0.0,0.00044872747132420693,linear_with_warmup,4.0,1.0,192.0,9.219715077395071e-05,,COMPLETE
10,0.1450685475917676,2020-09-23 23:05:35.024116,2020-09-24 05:23:22.026429,0 days 06:17:47.002313000,128.0,0.1,0.007310111797987596,constant_with_warmup,2.0,4.0,256.0,1.476115008130519e-06,,COMPLETE
11,0.12503298750532407,2020-09-23 23:43:07.223734,2020-09-24 05:45:20.715317,0 days 06:02:13.491583000,32.0,0.2,0.0018051818469068575,constant_with_warmup,4.0,4.0,256.0,2.841114256527787e-06,,COMPLETE
12,0.1816097065116658,2020-09-24 00:14:59.487753,2020-09-24 07:58:16.565621,0 days 07:43:17.077868000,64.0,0.3,0.0035369627815349334,linear_with_warmup,3.0,5.0,256.0,1.3109865478315319e-06,,COMPLETE
13,0.10370333631402247,2020-09-24 01:09:25.943943,2020-09-24 04:58:01.811407,0 days 03:48:35.867464000,32.0,0.0,0.0007308343139820534,constant_with_warmup,2.0,1.0,192.0,4.001652362213267e-05,,COMPLETE
14,0.23939939460352613,2020-09-24 01:34:30.348116,2020-09-24 09:43:33.172419,0 days 08:09:02.824303000,64.0,0.1,0.0016325994855553815,constant_with_warmup,1.0,5.0,256.0,3.4425122132471606e-05,,COMPLETE
15,,2020-09-24 04:58:01.874883,2020-09-24 11:17:45.295409,0 days 06:19:43.420526000,64.0,0.1,0.008668059563013286,constant_with_warmup,1.0,4.0,256.0,6.938379564642981e-06,"Trial 15 failed, because the returned value from the objective function cannot be cast to float. Returned value is: None",FAIL
16,0.19847044654375876,2020-09-24 05:23:22.080551,2020-09-24 11:31:06.603755,0 days 06:07:44.523204000,64.0,0.0,0.0018134014683119828,constant_with_warmup,3.0,4.0,256.0,5.8824882033002364e-06,,COMPLETE
17,0.24621042465193652,2020-09-24 05:45:20.752975,2020-09-24 13:07:10.388213,0 days 07:21:49.635238000,64.0,0.0,0.002197240591353136,constant_with_warmup,1.0,5.0,256.0,6.076373080211076e-06,,COMPLETE
18,0.23933821625659385,2020-09-24 07:58:16.638788,2020-09-24 15:18:57.396770,0 days 07:20:40.757982000,64.0,0.1,0.0016718737697774958,constant_with_warmup,1.0,5.0,256.0,7.706181684756914e-06,,COMPLETE
19,0.23976047352560612,2020-09-24 09:43:33.226391,2020-09-24 17:35:44.867065,0 days 07:52:11.640674000,64.0,0.1,0.0016444333581121851,constant_with_warmup,1.0,5.0,256.0,2.9377471422490166e-05,,COMPLETE
20,0.23444298243061648,2020-09-24 11:17:45.453422,2020-09-24 19:20:03.976861,0 days 08:02:18.523439000,64.0,0.1,0.0014094428324263354,constant_with_warmup,1.0,5.0,256.0,2.4996897088008264e-05,,COMPLETE
21,0.2718788431167765,2020-09-24 11:31:06.687872,2020-09-24 19:29:33.241110,0 days 07:58:26.553238000,256.0,0.1,0.0015199775986919997,constant_with_warmup,1.0,5.0,256.0,2.710526508489419e-05,,COMPLETE
22,0.26587080207588965,2020-09-24 13:07:10.526682,2020-09-25 01:13:47.273409,0 days 12:06:36.746727000,64.0,0.1,0.0017938535634534414,constant_with_warmup,1.0,5.0,64.0,9.586289687410264e-06,,COMPLETE
23,0.2666834431647279,2020-09-24 15:18:57.531680,2020-09-25 03:39:52.407864,0 days 12:20:54.876184000,64.0,0.1,0.0020584288964087634,constant_with_warmup,1.0,5.0,64.0,3.6402051187029456e-05,,COMPLETE
24,0.257321493296745,2020-09-24 17:35:44.937027,2020-09-25 06:20:25.070998,0 days 12:44:40.133971000,64.0,0.0,0.0012206039361919846,constant_with_warmup,1.0,5.0,64.0,1.2170044084692852e-05,,COMPLETE
25,0.18702279646632328,2020-09-24 19:20:04.064089,2020-09-25 07:36:32.346887,0 days 12:16:28.282798000,64.0,0.0,0.009023007642382636,constant_with_warmup,1.0,5.0,64.0,1.2068710996968151e-05,,COMPLETE
26,0.24751190549511828,2020-09-24 19:29:33.313832,2020-09-25 04:34:33.917431,0 days 09:05:00.603599000,64.0,0.0,0.002412960644586035,constant_with_warmup,1.0,5.0,256.0,1.2023224838604313e-05,,COMPLETE
27,,2020-09-25 01:13:47.375633,2020-09-25 12:34:04.533132,0 days 11:20:17.157499000,256.0,0.0,0.0023355647727170315,constant_with_warmup,1.0,5.0,64.0,1.1968278169788097e-05,"Trial 27 failed, because the returned value from the objective function cannot be cast to float. Returned value is: None",FAIL
28,0.25813376300984264,2020-09-25 03:39:52.469137,2020-09-25 13:31:53.211565,0 days 09:52:00.742428000,256.0,0.1,0.002753933416631437,constant_with_warmup,1.0,4.0,64.0,1.419993019035832e-05,,COMPLETE
29,0.0997033413388336,2020-09-25 04:34:33.974680,2020-09-25 14:39:08.559395,0 days 10:04:34.584715000,256.0,0.1,0.009582966446943305,constant_with_warmup,1.0,4.0,64.0,7.130195530180378e-05,,COMPLETE
30,0.2543135862024351,2020-09-25 06:20:25.136578,2020-09-25 16:15:35.522109,0 days 09:55:10.385531000,256.0,0.1,0.0027582212540481917,constant_with_warmup,1.0,4.0,64.0,6.19893738864591e-05,,COMPLETE
31,0.256452230497752,2020-09-25 07:36:32.401759,2020-09-25 14:55:57.639825,0 days 07:19:25.238066000,256.0,0.1,0.002690350788784528,constant_with_warmup,1.0,4.0,128.0,6.116827955573935e-05,,COMPLETE
32,0.2663430767497548,2020-09-25 12:34:04.573577,2020-09-25 19:45:23.417394,0 days 07:11:18.843817000,256.0,0.1,0.0009660705963674174,constant_with_warmup,1.0,4.0,128.0,5.214495378279618e-05,,COMPLETE
33,0.2671923405714162,2020-09-25 13:31:53.286185,2020-09-25 20:59:01.135265,0 days 07:27:07.849080000,256.0,0.2,0.0010313520078357877,constant_with_warmup,1.0,4.0,128.0,5.292579508469213e-05,,COMPLETE
34,0.2318375006672089,2020-09-25 14:39:08.735551,2020-09-25 21:52:26.163520,0 days 07:13:17.427969000,256.0,0.2,0.0009981926120123973,constant_with_warmup,2.0,3.0,128.0,4.840647276703619e-05,,COMPLETE
35,0.20338476747486628,2020-09-25 14:55:57.796078,2020-09-25 22:13:36.249312,0 days 07:17:38.453234000,256.0,0.2,0.0010619497509737933,cosine_with_warmup,2.0,3.0,128.0,3.8140069013298925e-05,,COMPLETE
36,0.159019311853665,2020-09-25 16:15:35.592656,2020-09-25 23:07:20.193319,0 days 06:51:44.600663000,64.0,0.2,0.0010817109325224263,cosine_with_warmup,2.0,3.0,128.0,1.8159928141905912e-05,,COMPLETE
37,,2020-09-25 19:45:23.496022,2020-09-25 21:54:45.673088,0 days 02:09:22.177066000,256.0,0.2,0.0009228699140777277,constant_with_warmup,1.0,5.0,128.0,4.353705637186656e-05,"Trial 37 failed, because the returned value from the objective function cannot be cast to float. Returned value is: None",FAIL
38,0.20032899021783665,2020-09-25 20:59:01.192948,2020-09-26 04:01:29.700431,0 days 07:02:28.507483000,256.0,0.2,0.0010911414996204744,cosine_with_warmup,2.0,3.0,128.0,4.3486039731530976e-05,,COMPLETE
39,0.19541807453949295,2020-09-25 21:52:26.214984,2020-09-26 04:57:04.857096,0 days 07:04:38.642112000,256.0,0.2,0.00047564381751244537,cosine_with_warmup,2.0,3.0,128.0,9.360331290694686e-05,,COMPLETE
40,0.1986999539230677,2020-09-25 21:54:45.685993,2020-09-26 04:44:47.232602,0 days 06:50:01.546609000,256.0,0.2,0.000530666721647562,cosine_with_warmup,2.0,3.0,128.0,8.18164872474111e-05,,COMPLETE
41,0.25530974725595396,2020-09-25 22:13:36.291762,2020-09-26 05:30:47.632589,0 days 07:17:11.340827000,256.0,0.2,0.0005301516386390742,constant_with_warmup,1.0,4.0,128.0,9.69108538329369e-05,,COMPLETE
42,0.25615788398758904,2020-09-25 23:07:20.242121,2020-09-26 06:38:42.187371,0 days 07:31:21.945250000,256.0,0.2,0.0005467318330131578,constant_with_warmup,1.0,4.0,128.0,8.60539316115623e-05,,COMPLETE
43,0.25393814762693745,2020-09-26 04:01:29.807595,2020-09-26 11:26:59.541276,0 days 07:25:29.733681000,256.0,0.2,0.0004908476345407876,constant_with_warmup,1.0,4.0,128.0,9.788322419228706e-05,,COMPLETE
44,0.24874937678105755,2020-09-26 04:44:47.277651,2020-09-26 11:05:19.216987,0 days 06:20:31.939336000,256.0,0.1,0.0005472877844855109,constant_with_warmup,1.0,4.0,192.0,3.0384605704393823e-05,,COMPLETE
45,0.2554862983771814,2020-09-26 04:57:04.898930,2020-09-26 11:33:21.235830,0 days 06:36:16.336900000,256.0,0.1,0.0008035938321632933,constant_with_warmup,1.0,4.0,192.0,2.8805876994106665e-05,,COMPLETE
46,0.2563914292986479,2020-09-26 05:30:47.675213,2020-09-26 11:48:01.525272,0 days 06:17:13.850059000,256.0,0.1,0.0008506099820595292,constant_with_warmup,1.0,4.0,192.0,2.8976346517473395e-05,,COMPLETE
47,0.21596017801171388,2020-09-26 06:38:42.258429,2020-09-26 12:02:32.331463,0 days 05:23:50.073034000,256.0,0.1,0.00034354667082883906,constant_with_warmup,1.0,2.0,192.0,1.811761708279878e-05,,COMPLETE
48,0.3017624078541192,2020-09-26 11:05:19.310140,2020-09-27 00:08:13.293316,0 days 13:02:53.983176000,256.0,0.1,0.0007826777795516414,constant_with_warmup,1.0,5.0,64.0,2.0444843533748995e-05,,COMPLETE
49,0.2777096260126037,2020-09-26 11:26:59.580907,2020-09-26 23:55:10.767541,0 days 12:28:11.186634000,128.0,0.1,0.0008418287234540906,constant_with_warmup,1.0,5.0,64.0,5.093452560701903e-05,,COMPLETE
50,0.257286350627454,2020-09-26 11:33:21.276202,2020-09-26 19:47:03.150233,0 days 08:13:41.874031000,128.0,0.1,0.0012954156653044834,constant_with_warmup,1.0,2.0,64.0,1.7271821972144064e-05,,COMPLETE
51,0.24256666474487515,2020-09-26 11:48:01.559283,2020-09-27 00:05:45.579606,0 days 12:17:44.020323000,128.0,0.1,0.000296685270854632,constant_with_warmup,1.0,5.0,64.0,4.412207805659117e-06,,COMPLETE
52,0.301068481692706,2020-09-26 12:02:32.367099,2020-09-27 00:05:54.111933,0 days 12:03:21.744834000,128.0,0.1,0.004683149052573698,linear_with_warmup,1.0,5.0,64.0,5.077552953573959e-05,,COMPLETE
53,0.2503573876255477,2020-09-26 19:47:03.242185,2020-09-27 08:03:39.296286,0 days 12:16:36.054101000,32.0,0.1,0.0052278914940365765,linear_with_warmup,1.0,5.0,64.0,4.939252715399727e-05,,COMPLETE
54,0.2657179426774296,2020-09-26 23:55:10.852553,2020-09-27 12:48:54.817157,0 days 12:53:43.964604000,128.0,0.1,0.0008667558777516193,linear_with_warmup,1.0,5.0,64.0,5.2198607817562426e-05,,COMPLETE
55,0.2554140772564319,2020-09-27 00:05:45.618127,2020-09-27 12:03:25.760913,0 days 11:57:40.142786000,128.0,0.3,0.0006871016318315292,linear_with_warmup,1.0,5.0,64.0,5.214793863239699e-05,,COMPLETE
56,0.11300449005593835,2020-09-27 00:05:54.258591,2020-09-27 12:14:24.155799,0 days 12:08:29.897208000,128.0,0.3,0.005767717174890485,linear_with_warmup,3.0,5.0,64.0,5.0331396793101675e-05,,COMPLETE
57,0.21241705177156414,2020-09-27 00:08:13.331067,2020-09-27 12:30:24.323270,0 days 12:22:10.992203000,128.0,0.3,0.0006864582822273106,linear_with_warmup,3.0,5.0,64.0,2.3350293339239297e-05,,COMPLETE
58,,2020-09-27 08:03:39.470500,2020-09-27 13:40:09.562911,0 days 05:36:30.092411000,128.0,0.1,0.0006606353444424354,linear_with_warmup,1.0,5.0,64.0,2.3329170061581143e-05,"Trial 58 failed because of the following error: UnboundLocalError(""local variable 'parser' referenced before assignment"")",FAIL
59,,2020-09-27 12:03:25.845385,2020-09-27 13:40:06.016579,0 days 01:36:40.171194000,128.0,0.1,0.005752309582366931,linear_with_warmup,1.0,5.0,64.0,2.330811601318439e-05,"Trial 59 failed because of the following error: UnboundLocalError(""local variable 'parser' referenced before assignment"")",FAIL
60,,2020-09-27 12:14:24.199686,2020-09-27 13:40:06.005110,0 days 01:25:41.805424000,128.0,0.1,0.0020677555290904317,linear_with_warmup,1.0,5.0,64.0,2.3426857926695495e-05,"Trial 60 failed because of the following error: UnboundLocalError(""local variable 'parser' referenced before assignment"")",FAIL
61,,2020-09-27 12:30:24.360033,,,,,,,,,,,,RUNNING
62,,2020-09-27 12:48:54.866409,2020-09-27 13:40:06.026771,0 days 00:51:11.160362000,128.0,0.1,0.003633447261291504,linear_with_warmup,1.0,5.0,64.0,3.524573140286806e-05,"Trial 62 failed because of the following error: UnboundLocalError(""local variable 'parser' referenced before assignment"")",FAIL
63,,2020-09-27 13:40:06.045643,,,,,,,,,,,,RUNNING
64,,2020-09-27 13:40:06.056662,,,,,,,,,,,,RUNNING
65,,2020-09-27 13:40:06.080563,,,,,,,,,,,,RUNNING
66,,2020-09-27 13:40:09.627909,,,,,,,,,,,,RUNNING
67,,2020-09-27 15:41:08.737905,2020-09-28 02:59:49.515633,0 days 11:18:40.777728000,128.0,0.1,0.0013879421577590915,linear_with_warmup,1.0,5.0,64.0,3.5886344166229995e-05,"Trial 67 failed, because the returned value from the objective function cannot be cast to float. Returned value is: None",FAIL
68,,2020-09-27 15:41:08.776782,2020-09-28 02:54:19.503982,0 days 11:13:10.727200000,128.0,0.1,0.003470985163275523,linear_with_warmup,1.0,5.0,64.0,3.383849324076355e-05,"Trial 68 failed, because the returned value from the objective function cannot be cast to float. Returned value is: None",FAIL
69,0.2867569195879808,2020-09-27 15:41:08.797145,2020-09-28 04:25:47.871736,0 days 12:44:39.074591000,128.0,0.1,0.0014178613260021576,linear_with_warmup,1.0,5.0,64.0,3.626894375138902e-05,,COMPLETE
70,0.30237907480935455,2020-09-27 15:41:08.827117,2020-09-28 04:17:00.510167,0 days 12:35:51.683050000,128.0,0.1,0.0020865902712531225,linear_with_warmup,1.0,5.0,64.0,3.468455444337233e-05,,COMPLETE
71,0.30050852042305726,2020-09-27 15:41:08.832711,2020-09-28 03:54:13.051487,0 days 12:13:04.218776000,128.0,0.1,0.0037792291329153908,linear_with_warmup,1.0,5.0,64.0,3.914876601212752e-05,,COMPLETE
72,,2020-09-28 02:54:19.557617,2020-09-28 08:47:43.609114,0 days 05:53:24.051497000,128.0,0.1,0.0036129657223789575,linear_with_warmup,1.0,5.0,64.0,3.538589868682481e-05,"Trial 72 failed because of the following error: UnboundLocalError(""local variable 'parser' referenced before assignment"")",FAIL
73,,2020-09-28 02:59:49.530441,,,128.0,0.1,0.0015456347608126956,linear_with_warmup,1.0,5.0,64.0,3.540529658790237e-05,"Trial 73 failed because of the following error: UnboundLocalError(""local variable 'parser' referenced before assignment"")",RUNNING
74,,2020-09-28 03:54:13.149586,,,,,,,,,,,,RUNNING
75,,2020-09-28 04:17:00.551830,,,128.0,0.1,0.003993023804997474,linear_with_warmup,1.0,5.0,64.0,3.3708499761736995e-05,"Trial 75 failed because of the following error: UnboundLocalError(""local variable 'parser' referenced before assignment"")",RUNNING
76,,2020-09-28 04:25:47.905964,2020-09-28 08:47:43.771814,0 days 04:21:55.865850000,128.0,0.1,0.0035962844412249454,linear_with_warmup,1.0,5.0,64.0,3.3755771155581176e-05,"Trial 76 failed because of the following error: UnboundLocalError(""local variable 'parser' referenced before assignment"")",FAIL
77,0.3070369492342787,2020-09-28 09:16:23.111483,2020-09-29 02:18:17.744763,0 days 17:01:54.633280000,128.0,0.1,0.0039688403793215555,linear_with_warmup,1.0,5.0,64.0,2.1278248124836783e-05,,COMPLETE
78,0.2985063309958485,2020-09-28 09:16:23.133944,2020-09-29 02:06:54.836431,0 days 16:50:31.702487000,128.0,0.1,0.0036055943386889256,linear_with_warmup,1.0,5.0,64.0,3.3828225790096766e-05,,COMPLETE
79,0.30559847018073816,2020-09-28 09:16:23.158827,2020-09-29 02:31:06.937354,0 days 17:14:43.778527000,128.0,0.1,0.004086666987859947,linear_with_warmup,1.0,5.0,64.0,3.463633120287673e-05,,COMPLETE
80,0.3102709585536119,2020-09-28 09:16:23.179334,2020-09-29 01:59:20.994782,0 days 16:42:57.815448000,128.0,0.1,0.003703400383132041,linear_with_warmup,1.0,5.0,64.0,3.429330505787207e-05,,COMPLETE
81,0.2952604040417155,2020-09-28 09:16:23.201072,2020-09-29 00:41:48.899959,0 days 15:25:25.698887000,128.0,0.1,0.004738758832593967,linear_with_warmup,1.0,5.0,64.0,3.5500703778814606e-05,,COMPLETE
82,,2020-09-29 00:41:49.124828,,,,,,,,,,,,RUNNING
83,,2020-09-29 02:18:17.786235,,,,,,,,,,,,RUNNING
84,,2020-09-29 08:13:06.902013,,,,,,,,5.0,64.0,,,RUNNING
85,,2020-09-29 08:13:06.929315,,,,,,,,,,,,RUNNING
86,,2020-09-29 08:13:06.965163,,,,,0.006669801745933131,,1.0,,,,,RUNNING
87,,2020-09-29 08:13:06.984360,,,128.0,0.1,,linear_with_warmup,,,,2.1019304960471535e-05,,RUNNING
88,,2020-09-29 08:13:07.004442,,,,,,,,,,,,RUNNING
89,0.23956406481755363,2020-09-29 15:23:37.151849,2020-09-29 20:03:09.167857,0 days 04:39:32.016008000,128.0,0.1,0.006589577537849375,linear_with_warmup,1.0,5.0,64.0,1.9813863773159384e-05,,COMPLETE
90,,2020-09-29 15:23:37.175400,2020-09-29 19:39:47.140223,0 days 04:16:09.964823000,128.0,0.1,0.007083400526732463,linear_with_warmup,1.0,5.0,64.0,2.165465500239775e-05,"Trial 90 failed, because the returned value from the objective function cannot be cast to float. Returned value is: None",FAIL
91,0.2390785745689173,2020-09-29 15:23:37.199292,2020-09-29 20:33:03.287041,0 days 05:09:26.087749000,128.0,0.1,0.006878617754624457,linear_with_warmup,1.0,5.0,64.0,2.0769635582688433e-05,,COMPLETE
92,0.2405223666074387,2020-09-29 15:23:37.222804,2020-09-29 20:20:25.291618,0 days 04:56:48.068814000,128.0,0.1,0.006608674194695848,linear_with_warmup,1.0,5.0,64.0,2.0561328716256003e-05,,COMPLETE
93,0.24204247685838745,2020-09-29 15:23:37.247946,2020-09-29 20:14:00.128169,0 days 04:50:22.880223000,128.0,0.1,0.006418922985266756,linear_with_warmup,1.0,5.0,64.0,2.100976400998885e-05,,COMPLETE
94,0.2395305453889219,2020-09-29 19:39:47.167801,2020-09-30 00:25:19.504300,0 days 04:45:32.336499000,128.0,0.1,0.007017084843437193,linear_with_warmup,1.0,5.0,64.0,2.129185987893225e-05,,COMPLETE
95,0.2527056625992473,2020-09-29 20:03:09.312734,2020-09-30 01:57:18.425446,0 days 05:54:09.112712000,128.0,0.1,0.003361461851610098,linear_with_warmup,1.0,5.0,64.0,2.3162903400635034e-05,,COMPLETE
96,0.25217374697056727,2020-09-29 20:14:00.178368,2020-09-30 05:21:47.858805,0 days 09:07:47.680437000,128.0,0.0,0.0033119903380448928,linear_with_warmup,1.0,5.0,64.0,4.2705546322513736e-05,,COMPLETE
97,0.24905563297753966,2020-09-29 20:20:25.372134,2020-09-30 06:20:51.851338,0 days 10:00:26.479204000,128.0,0.0,0.004051310618254635,linear_with_warmup,1.0,5.0,64.0,2.4584035015057494e-05,,COMPLETE
98,0.2434141842902576,2020-09-29 20:33:03.329585,2020-09-30 06:13:52.656680,0 days 09:40:49.327095000,128.0,0.0,0.003296501602612283,linear_with_warmup,2.0,5.0,64.0,4.346768310580568e-05,,COMPLETE
99,0.22966404559686193,2020-09-30 00:25:19.600999,2020-09-30 07:06:08.166814,0 days 06:40:48.565815000,128.0,0.0,0.0041451454688142516,linear_with_warmup,2.0,5.0,64.0,4.2583549474588404e-05,,COMPLETE
100,0.22745367614943507,2020-09-30 01:57:18.493557,2020-09-30 07:56:22.301254,0 days 05:59:03.807697000,128.0,0.0,0.004387920095138801,linear_with_warmup,2.0,5.0,64.0,4.286228931668955e-05,,COMPLETE
101,0.22700147354610428,2020-09-30 05:21:47.953043,2020-09-30 10:12:23.357162,0 days 04:50:35.404119000,128.0,0.1,0.004276493263714614,linear_with_warmup,2.0,5.0,64.0,2.5841673097277397e-05,,COMPLETE
102,0.2501039200766569,2020-09-30 06:13:52.703932,2020-09-30 10:49:42.448550,0 days 04:35:49.744618000,128.0,0.1,0.00386010820445652,linear_with_warmup,1.0,5.0,64.0,3.190209559097998e-05,,COMPLETE
103,0.2466594544545694,2020-09-30 06:20:51.901975,2020-09-30 11:36:21.433107,0 days 05:15:29.531132000,128.0,0.1,0.004646518576392377,linear_with_warmup,1.0,5.0,64.0,6.967890116345716e-05,,COMPLETE
104,0.23404317549807105,2020-09-30 07:06:08.419168,2020-09-30 11:51:48.289236,0 days 04:45:39.870068000,128.0,0.1,0.008180312457185687,linear_with_warmup,1.0,5.0,64.0,1.55138979840505e-05,,COMPLETE
105,0.25787720584970686,2020-09-30 07:56:22.420230,2020-09-30 12:56:37.078211,0 days 05:00:14.657981000,128.0,0.1,0.0021900205848933937,linear_with_warmup,1.0,5.0,64.0,3.2497749362611606e-05,,COMPLETE
106,,2020-09-30 10:12:23.434205,2020-09-30 14:49:59.073249,0 days 04:37:35.639044000,128.0,0.1,0.008271918338150717,linear_with_warmup,1.0,5.0,64.0,3.325422224870109e-05,"Trial 106 failed, because the returned value from the objective function cannot be cast to float. Returned value is: None",FAIL
107,0.22738905430103915,2020-09-30 10:49:42.516456,2020-09-30 15:11:58.882565,0 days 04:22:16.366109000,32.0,0.1,0.0023146235201715374,linear_with_warmup,1.0,5.0,64.0,6.990908292423875e-05,,COMPLETE
108,0.23754827785573757,2020-09-30 11:36:21.481437,2020-09-30 16:36:34.865255,0 days 05:00:13.383818000,32.0,0.1,0.007929431646308235,linear_with_warmup,1.0,5.0,64.0,1.5799732025016544e-05,,COMPLETE
